date,headline,description
2024-04-09 12:00:00,"Paradigm leads $225 million round for Monad Labs, which is building a layer-1 blockchain to take on Ethereum and Solana",The crypto firm founded by ex-Jump Crypto traders also received investment from Electric Capital and Neil Mehta's Greenoaks Capital.
2024-04-29 15:40:25,Are crypto partnerships back? Eminem becomes new voice of Crypto.com,Eminem is narrating a new Crypto.com commercial. Are celebrity ambassadors prepared to put 2022 behind them?
2024-05-01 13:00:00,Ex-Coinbase designer raises $5M for crypto voting service Agora,"Protocol governance has a ""reputation of being chaotic."" Agora wants to change that."
2024-04-24 13:00:00,Crypto app Strike launches Bitcoin services across Europe,Founder and CEO Jack Mallers said the company is profitable after an $80 million funding round in 2022.
2024-04-16 12:47:36,7 people with power at Coinbase,The list contains senior executives but also a few surprises from other parts of the flagship crypto company.
2024-04-05 17:09:41,FTX just sold nearly $2 billion of SOL at a steep discount. Here’s what that means for creditors,The bankrupt crypto exchange FTX has reportedly sold about two-thirds of its $2.6 billion in Solana tokens.
2024-04-30 19:02:46,"Binance founder Changpeng ‘CZ’ Zhao sentenced to 4 months in prison, will enter as country’s richest inmate","The settlement came amid a string of enforcement actions against crypto industry leaders, including FTX's Sam Bankman-Fried."
2024-04-19 19:56:39,Don’t call it a stablecoin: How did a ‘synthetic dollar’ generate a yield of 113%?,"DEK: Tokenizing the cash-and-carry trade, Ethena is turning heads in the crypto market. But some worry its risks are being overlooked amid the latest bull run."
2024-05-01 17:02:59,"Bitcoin tumbles below $57,000 on day of Fed meeting","With slowing ETF inflows and the Bitcoin halving in the rearview, the crypto industry is facing macroeconomic conditions, which are ""cloudy at best.”"
2024-05-02 13:00:00,Ex-DFS regulator raises $5.1 million for crypto venture fund backed by Winklevoss twins and Robert Leshner,Matthew Homer was formerly an executive deputy superintendent at the New York Department of Financial Services.
2024-04-11 11:00:00,Buying crypto for your kids? Here’s how to ensure they get it when when you pass on,Don’t let lost keys or blockchain blackholes become your legacy.
2024-04-09 13:00:00,Anthony Pompliano and ex-TechCrunch reporter launch Token Relations to improve crypto projects’ communications,"The project, which is bootstrapped by Pompliano, counts Avalanche, Aptos, and Optimism as launch partners."
2024-04-10 18:16:50,SEC moves to sue Uniswap in bid to hobble fast-growing DeFi sector,The SEC's impending lawsuit against Uniswap Labs will be a major test for the emerging DeFi sector.
2024-05-01 12:00:00,BlackRock leads $47 million round for Securitize: ‘Another step in the evolution of our digital assets strategy’,"Other investors include Hamilton Lane and Tradeweb Markets, with traditional financial firms diving headfirst into tokenization."
2024-04-10 16:21:15,‘The kids are not all right’: Gen Zers and millennials are as likely to own crypto as real estate,A survey found that about one-fifth of younger generations own digital assets—about the same portion as who own real estate—and that they're also more likely to own crypto than stocks.
2024-04-04 11:00:00,DeFi developers behind crypto exchange Phoenix close $20 million Series A round,"Led by Paradigm, Ellipsis Labs today announced $20 million in Series A funding to accelerate Phoenix, its decentralized spot exchange."
2024-04-17 15:00:00,"Worldcoin, Sam Altman’s eye-scanning crypto project, announces its own blockchain",The blockchain will be deeply entwined with the Worldcoin protocol and is aimed at accelerating adoption of World ID.
2024-04-23 16:44:48,"Following ‘halving,’ Bitcoin makes slight gains as shares of crypto-linked firms soar","Bitcoin is up less than 4% since the halving, but related stock prices are seeing bigger gains."
2024-04-25 18:01:08,"SEC sued over Ethereum, crypto firm asks court to state token is not a security","The lawsuit was filed by MetaMask-maker Consensys, which is seeking an injunction to block the SEC from investigating Ethereum."
2024-04-30 18:54:07,Feds charge ‘Bitcoin Jesus’ with $50 million tax fraud,Roger Ver is a famous figure from the early days of Bitcoin who renounced his citizenship.
2024-04-30 21:28:54,PayPal CEO nods to ‘compelling’ stablecoin potential as total Q1 payments rise 14%,"PayPal's quarterly earnings were up, but its CEO stayed relatively quiet on the company's new stablecoin."
2024-04-15 15:07:00,Why VCs are pouring hundreds of millions of dollars into a little-known AI crypto project called Bittensor,"Prominent blockchain firms including Polychain, Digital Currency Group, and dao5 are buying up TAO, the token for the decentralized AI company Bittensor."
2024-04-16 16:38:15,Bitcoin struggles to regain momentum after weekend wipeout erased more than 10%,"Since Bitcoin’s sudden tumble on Saturday, the original cryptocurrency has been hovering near $62,000."
2024-04-14 15:57:10,Bitcoin 'halving' will cost crypto miners $10 billion a year in lost revenue and 'could well determine who comes out ahead and who gets left behind',"Around April 20, the halving will cut the amount of Bitcoin that “miners” can earn each day for validating transactions to 450 from 900 now."
2024-04-25 09:03:12,Instagram influencer ‘Jay Mazini’ who swindled millions in crypto scheme that preyed on Muslims sentenced to 7 years in jail,Former Instagram influencer “Jay Mazini” who swindled millions of dollars from online followers and a network of Muslims was sentenced to seven years in prison.
2024-04-15 20:17:38,"Lacking access to mainland Chinese investors, Hong Kong’s crypto ETFs will be ‘nickels and dimes’ compared with U.S. versions","Hong Kong’s ETF market is worth about $50 billion, compared with $8.87 trillion in the U.S."
2024-04-18 11:00:00,"Venture capital continues Web3 retreat, but Q1 hints at a changing tide","Web3 startups raised just short of $1.9 billion across 346 deals, according to new data, a 58% increase from Q3 2024."
2024-04-25 14:45:00,Movement Labs raises $38 million to build layer-2 blockchain on Ethereum with Facebook tech,"Polychain led the Series A funding round, which included participation from Hack VC, dao5, and Robot Ventures."
2024-04-04 17:15:42,SEC commissioner lets rip on chairman Gary Gensler’s leadership for ‘stilted communication’,"Former SEC official criticizes speech: “If that speech had to be transparent in the way SEC filings have to be, she’d be subject to SEC enforcement.”"
2024-04-13 23:19:06,Markets flash early signs of risk from wider Mideast war as crypto prices sink after Iran launches wave of drones at Israel,"A fuller picture of Wall Street's reaction to Iran's assault on Israel will come on Sunday evening, when futures trading opens in the U.S. for stocks, bonds, commodities and currencies."
2024-04-11 13:04:12,"SEC investigated NBA Top Shot developer Dapper Labs, decided to close case in September",The NFT company still faces an ongoing class action suit in New York that alleges it sold unregistered securities.
2024-04-29 12:00:00,Tiger Global-backed Braintrust bet big on blockchain. Now it’s launching an AI-powered hiring platform,"Braintrust Air will use AI to conduct autonomous interviews with job candidates, with Nestle and Guardian Life already signed up."
2024-04-29 10:30:00,Why Sam Bankman-Fried is turning against A-list FTX boosters—and what could happen to them,Some of the celebs who took money to tout SBF’s exchange may be in hotter water than others.
2024-04-24 13:16:42,Old Bitcoin wallets keep waking up: How many of the 1.8 million ‘lost’ coins are really gone?,A new survey by Chainalysis and Fortune takes a closer look at dormant wallets from the early Bitcoin era that hold over $1.2 billion.
2024-04-24 15:44:57,DOJ seeks 3-year sentence—double federal guidelines—for Binance’s Changpeng Zhao,"Prosecutors said 36 months would be an appropriate term given the Binance founder's ""willful violation of U.S. law and its consequences."""
2024-04-11 17:41:11,VanEck CEO says brokerage platforms aren’t yet recommending Bitcoin ETFs: ‘There’s a long ways to go’,Jan van Eck told Fortune that he doesn't expect the SEC to approve an Ethereum ETF.
2024-05-01 12:00:00,"Multicoin Capital leads $5 million round for Baxus, a Web3 marketplace for wine and spirits","The global luxury wines and spirits market is forecast to almost double in size by 2032, and BAXUS wants to streamline the marketplace."
2024-04-12 21:40:48,Deion Sanders' son reveals the crypto advice he should've taken from his NFL Hall of Famer dad—but didn't—and his ambitious financial goal: 'Billionaire. That’s what it got to be',"""I wish I would have just taken it out and listened to my dad when he told me. He said take it out right then. But I didn’t."""
2024-04-20 16:39:33,A dot-com entrepreneur who once lost $6 billion in one day has made billions from the Bitcoin rally and his company's surging shares,Saylor has billions of dollars worth of paper gains from his holdings of MicroStrategy stock and his personal Bitcoin stash.
2024-04-04 20:48:33,Sam Bankman-Fried's mom tried to explain her son to the judge—’he has never felt happiness or pleasure in his life and does not think he is capable of feeling it’,"""He has never been interested in praise, and has always deflected it,"" Barbara Fried wrote of SBF as she pleaded for a lenient sentence."
2024-05-02 22:06:58,"Coinbase revenue soars by 72% to $1.6 billion, smashing analysts’ predictions",The increase was fueled by a boost in consumer and institutional transactions due to favorable conditions in the wider cryptocurrency market.
2024-04-24 22:18:13,"Investors yank $2.2 billion from Cathie Wood’s once-mega popular Ark funds, even as tech skyrockets",The firm’s cumulative ETF assets are down 81% from 2021 highs.
2024-04-30 08:49:04,Binance founder CZ faces possible 3-year jail term for allowing money laundering as judge decides sentence,Zhao pleaded guilty and stepped down as Binance CEO in November as the company agreed to pay $4.3 billion to settle related allegations.
2024-04-26 15:45:11,"Bitcoin ETFs stall: BlackRock ends 71-day streak, Fidelity sees first outflows","The Bitcoin ETF frenzy has cooled a bit with the original cryptocurrency hovering near $63,500."
2024-04-24 17:28:53,The AI frenzy could fall flat as companies hoard chips without enough data centers to host them,"This “buy AI now, figure it out if it works later"" mode is the very mindset that could put sustainable AI innovation in jeopardy."
2024-04-29 11:46:35,Rich Americans' spending is driving the U.S. economy—and likely leading the Fed to delay interest rate cuts,"It's the so-called “wealth effect,"" whereby rising home and stock values give people confidence to increase their spending."
2024-04-26 23:43:54,Billionaire Miami Dolphins owner wants South Florida to be more like Manhattan—'I still love a challenge',"“I want to make West Palm a model city for the country,"" said Related Cos. founder, Stephen Ross."
