date,headline,description
2024-04-04 15:25:48,Texas Sees Surge in Job Losses as Greg Abbott Brags About Economy," As Governor Greg Abbott lauds Texas for surpassing the national economic growth rate, as measured by the state’s gross domestic product, the Lone Star State faces a surge in job losses, primarily in the retail and manufacturing sectors. 
Texas saw an unexpected increase of 2,274 initial jobless claims for the week ending March 23, according to data published by the Department of Labor on April 4, casting a shadow over the state’s economic celebrations. 
In a broader context, the national landscape mirrors Texas’ labor-market challenges. Total initial jobless claims across the U.S. have risen to 221,000, the new data showed, marking an increase from the previous week’s 210,000 and exceeding analysts’ expectations of 212,000. 
Texas’ new unemployment numbers arrived days after Abbott touted the state’s economic resilience and expansion, highlighted by a 5 percent annual growth rate in the fourth quarter of 2023. 
Newsweek has contacted Governor Greg Abbott’s office for comment by email. 
The contrast of burgeoning jobless claims with a proclaimed economic prosperity raises questions about the underlying health of the state’s economy. 
With notable layoffs across several industries and warnings from the Dallas Fed about potential workforce reductions this year, the situation in Texas could be a microcosm of a larger issue that could force the Federal Reserve to begin cutting interest rates as early as June, experts say. 
Ian Shepherdson, the chair and chief economist at Pantheon Macroeconomics, told Newsweek via email that WARN notices and Google searches for ”layoffs” point to an even greater increase in claims ahead, and a separate measure of hiring intentions is dwindling, suggesting that it may be harder for laid-off employees to find a job quickly. 
”As a result, we continue to expect labor-market developments, alongside CPI data, to guide the [Federal Reserve] to start easing in June,” he added. 
Texas Governor Greg Abbott at a forum. Companies such as Tramontina USA and Horton Automatics have initiated layoffs, cumulatively affecting thousands of workers. Texas Governor Greg Abbott at a forum. Companies such as Tramontina USA and Horton Automatics have initiated layoffs, cumulatively affecting thousands of workers. Justin Sullivan/Getty Images 
Despite Abbott’s optimistic outlook, the recent uptick in jobless claims, particularly in sectors integral to Texas’ economic identity—such as retail and manufacturing—signals potential turbulence ahead. Those sectors, historically pillars of the state’s economy, now reflect the vulnerabilities faced by Texan workers. 
Abbott’s remarks on April 2 underlined his confidence in the state’s economic direction. ”Texas is again outpacing the nation in economic expansion and job growth thanks to the best business climate and the strongest workforce in America,” he said, adding, ”As we continue to invest in education, workforce development, and infrastructure, we remain focused on building an even bigger, better Texas for decades to come.” 
However, the governor’s statements stand in contrast with the layoffs affecting thousands across the state. Companies such as Tramontina USA, WWL Vehicle Services Americas and Horton Automatics have initiated layoffs, cumulatively affecting thousands of workers. And WARN notices indicate that by May, even more layoffs may be coming to the state. 
In December, the Dallas Fed warned about potential workforce reductions for Texas in 2024, predicting a challenging year ahead. The predictions, rooted in analysis of WARN notices and labor-market trends, suggested an uneasy balance between job growth and layoffs in the Lone Star State. 
The implications of the layoffs extend beyond immediate job losses and suggest a potential cooling of Texas’ economy. While Abbott champions the state’s GDP growth and job creation, the rising initial jobless claims coincide with the Dallas Fed’s predictions of an unemployment rate growing to about 4.2 percent, up from the current rate of 3.9 percent."
2024-04-04 16:25:13,"Technology, Government, Financial Sectors Lead First-Quarter Job Cuts","The technology, government and financial sectors made the greatest number of job
cuts during the first quarter.

Across all industries, U.S. employers announced 257,254 job cuts during the
quarter, Challenger, Gray & Christmas said in a Thursday (April 4) press release
.

That total was up 120% from the 117,163 cuts announced in the previous quarter
but down 5% from the 270,416 layoffs announced in the first quarter of 2023,
according to the release.

“Layoffs certainly ticked up to round out the first quarter, though below last
year’s levels,” Andy Challenger, senior vice president of Challenger, Gray &
Christmas, said in the release. “Many companies appear to bereverting to a ‘do
more with less’ approach.”

The most cited reason for job cuts during the first quarter was “cost-cutting,”
the release said. Other commonly cited reasons include restructuring; business,
unit or store closures; market conditions; and bankruptcy.

The technology industry accounted for the greatest number of job cuts in the
first quarter, per the release. The industry announced 42,442 layoffs, down 59%
from the 102,391 cuts announced during the same period in 2023.

The sectors with the next-highest number of job cuts in the first quarter were
government, financial, services and transportation, according to the release.

Financial firms cut 28,715 jobs in the first three months of 2024, down 6% from
the 30,635 cuts announced in the first quarter of 2023, the release said.

“While technology continues to lead all industries so far this year, several
industries, including energy and industrial manufacturing, are cutting more jobs
this year than last,” Challenger said in the release.

The final month of the first quarter — March — saw the highest number of job
cuts since January 2023, according to the release.

The total of 90,309 layoffs announced in March was up 7% from 84,638 in February
and up 0.7% from 89,703 in March 2023, the release said.

March’s total was the highest since 102,943 job cuts were announced in January
2023, according to the release.

This news comes a day after ADP reported that private employers added 184,000 
jobs in March, the biggest increase since July 2023.

ADP said job gains were robust throughout industries, particularly in the
leisure and hospitality space and in construction. The one exception came from
the professional services field, which saw a drop in hiring.

The post Technology, Government, Financial Sectors Lead First-Quarter Job Cuts 
appeared first on PYMNTS.com."
2024-04-04 17:31:39,"Brownsville Veterans International Bridge expansion to enhance border trade, build economy", Local and federal funding will help pay for the $18 million project. The added lanes open are expected to open sometime next month.
2024-04-04 17:40:49,"Economy, expression, inclusion: What all will draw Pune artists’ votes","Economy, expression, inclusion: What all will draw Pune artists’ votes
Posted 2024-04-04, Indian Express Headlines
When candidates for the Lok Sabha elections come campaigning for Atul Pethe’s vote, they will be asked about their competence. Among the issues that the veteran theatre director, whose plays include ‘Satyashodhak’ revolving around Mahatma Jyotirao Phule, would ask a politician is how is his/her party going to ensure “an... read full story
”art, at its core and in spirit, has always been a mirror to society and, by its very definition, challenges the establishment”
Ask about this article"
2024-04-04 13:41:45,Kompany’s focus on Everton not struggling Burnley’s finances,"Yahoo Sports
Kompany’s focus on Everton not struggling Burnley’s finances
AFP
Thu, Apr 4, 2024, 8:41 AM
·3 min read
Link Copied
No talk of finances: Burnley manager Vincent Kompany is wary of discussing what relegation from the Premier League might mean for the club’s balance sheet (Darren Staples)
Burnley manager Vincent Kompany was unhappy at being asked about the club’s finances before Saturday’s key clash with Premier League relegation rivals Everton .
The Clarets have announced losses of £27.9 million ($35.3 million, 32.5 million euros) for the year ending July 31, 2023, in their latest accounts following relegation at the end of the 2021/22 season.
Burnley are currently six points from safety with seven games to play and a second relegation in three years would undoubtedly harm the northwest club’s finances.
Kompany when questioned what the club’s losses would mean from a football perspective told reporters: ”You’re asking me this -- it’s a three-game week and in 48 hours we’ve got one of the most important games of the season.
”What benefit is that to me to start talking to you about the accounts of the club?
”The only thing I can tell you is, do we look worried, like we’ve lost control and calmness? We don’t.
”Let me focus on the Everton game right now, that’s what matters.”
Burnley may be second-bottom in the league but they are unbeaten in their last four matches and keen to close the gap to Everton, three places above and seven points better off than the Clarets.
Kompany, who guided Burnley straight back to the Premier League in his first season in charge, was in no mood to talk about what relegation might mean for the club’s medium and long-term future.
”We’re not going to talk about that right now,” the former Manchester City and Belgium star said. ”I don’t know what to say, I don’t think about it right now.
”I’ve told you many times since January, those are the discussions we have mid-season and the beginning of the season, not when we have seven games left and still everything to play for.
”The only thing I’ll try to convey as a message is it’s a scenario the club has known in the past and it’s a club that hasn’t panicked in those moments. So why all of a sudden should we? Do we have to portray a crisis just because that’s what you’re supposed to look like?
He added: ”It’s a club that’s been there before in every situation - staying up, going down -- and it’s a club that always does the right thing in those moments and that won’t change.”
Right-back Lorenz Assignon is in contention for this weekend’s trip to Goodison Park after missing the 1-1 midweek draw with Wolves through suspension.
Burnley were also without six injured players on Tuesday and Kompany said Aaron Ramsey , Luca Koleosho , Nathan Redmond , Ameen Al-Dakhil , Jordan Beyer and Han-Noah Massengo were all being assessed.
jdg/iwd"
2024-04-04 20:38:29,In-Depth Analysis of the Machine Learning in Finance Market: A Comprehensive Study,"In-Depth Analysis of the Machine Learning in Finance Market: A Comprehensive Study
Guest Post By
Craig Francis Information Technology Markets
2024-04-05
Global Machine Learning in Finance Market Breakdown by Application (Algorithmic trading, Risk management, Fraud detection, Portfolio management, Customer service), by Component (Solution, Services, Implementation & Integration Service, Training & Support Service, Consulting Service), by Deployment Mode (On-premise, Cloud) and by Geography (North America, South America, Europe, Asia Pacific, MEA)
Latest research study released on the Global Machine Learning in Finance Market by HTF MI Research evaluates market size, trend, and forecast to 2030. The Machine Learning in Finance market study covers significant research data and proofs to be a handy resource document for managers, analysts, industry experts and other key people to have ready-to-access and self-analyzed study to help understand market trends, growth drivers, opportunities and upcoming challenges and about the competitors.
Key Players in This Report Include:
IBM (United States), Microsoft (United States), Amazon Web Services (AWS) (United States), Google Cloud Platform (GCP) (United States), SAS Institute (United States), Oracle (United States), Teradata (United States), Cloudera (United States), HPE (United States), FICO (United States), Experian (United States), Kensho Technologies (United States), AlphaSense (United States), Enova (United States), Scienaptic AI (United States), Socure (United States), Vectra AI (United States), Dataiku (United States), H2O.ai (United States), RapidMiner (United States), Domino Data Lab (United States), Databricks (United States), Snowflake (United States), Others
Download Sample Report PDF @ www.htfmarketintelligence.com/sample-…nce-market
According to HTF Market Intelligence, the Global Machine Learning in Finance market to witness a CAGR of XX% during forecast period of 2024-2030. The market is segmented by Global Machine Learning in Finance Market Breakdown by Application (Algorithmic trading, Risk management, Fraud detection, Portfolio management, Customer service) by Component (Solution, Services, Implementation & Integration Service, Training & Support Service, Consulting Service) by Deployment Mode (On-premise, Cloud) and by Geography (North America, South America, Europe, Asia Pacific, MEA).
Definition:
Artificial intelligence (AI) in the form of machine learning (ML) enables applications to predict outcomes more correctly without requiring special programming. ML algorithms use historical data as input to forecast new output values.
The application of machine learning (ML), which makes it possible to accurately forecast outcomes using historical data, is changing the banking industry. This technology is used in finance because data analysis reduces risk and enhances decision-making, task automation increases productivity, and customized recommendations enhance customer service.
Machine learning (ML) is used in a variety of fields, including portfolio management, fraud detection, risk management, algorithmic trading, and customer support.
Major Highlights of the Machine Learning in Finance Market report released by HTF MI:
Global Machine Learning in Finance Market Breakdown by Application (Algorithmic trading, Risk management, Fraud detection, Portfolio management, Customer service) by Component (Solution, Services, Implementation & Integration Service, Training & Support Service, Consulting Service) by Deployment Mode (On-premise, Cloud) and by Geography (North America, South America, Europe, Asia Pacific, MEA)
Global Machine Learning in Finance market report highlights information regarding the current and future industry trends, growth patterns, as well as it offers business strategies to helps the stakeholders in making sound decisions that may help to ensure the profit trajectory over the forecast years.
Geographically, the detailed analysis of consumption, revenue, market share, and growth rate of the following regions:
The Middle East and Africa (South Africa, Saudi Arabia, UAE, Israel, Egypt, etc.)
North America (United States, Mexico & Canada)
South America (Brazil, Venezuela, Argentina, Ecuador, Peru, Colombia, etc.)
Europe (Turkey, Spain, Turkey, Netherlands Denmark, Belgium, Switzerland, Germany, Russia UK, Italy, France, etc.)
Asia-Pacific (Taiwan, Hong Kong, Singapore, Vietnam, China, Malaysia, Japan, Philippines, Korea, Thailand, India, Indonesia, and Australia).
Objectives of the Report:
-To carefully analyze and forecast the size of the Machine Learning in Finance market by value and volume.
-To estimate the market shares of major segments of the Machine Learning in Finance market.
-To showcase the development of the Machine Learning in Finance market in different parts of the world.
-To analyze and study micro-markets in terms of their contributions to the Machine Learning in Finance market, their prospects, and individual growth trends.
-To offer precise and useful details about factors affecting the growth of the Machine Learning in Finance market.
-To provide a meticulous assessment of crucial business strategies used by leading companies operating in the Machine Learning in Finance market, which include research and development, collaborations, agreements, partnerships, acquisitions, mergers, new developments, and product launches.
Have a query? Market an enquiry  @ www.htfmarketintelligence.com/enquiry…nce-market
Points Covered in Table of Content of Global Machine Learning in Finance Market:
Chapter 01 – Machine Learning in Finance Executive Summary
Chapter 02 – Market Overview
Chapter 03 – Key Success Factors
Chapter 04 – Global Machine Learning in Finance Market – Pricing Analysis
Chapter 05 – Global Machine Learning in Finance Market Background
Chapter 06 — Global Machine Learning in Finance Market Segmentation
Chapter 07 – Key and Emerging Countries Analysis in Global Machine Learning in Finance Market
Chapter 08 – Global Machine Learning in Finance Market Structure Analysis
Chapter 09 – Global Machine Learning in Finance Market Competitive Analysis
Chapter 10 – Assumptions and Acronyms
Chapter 11 – Machine Learning in Finance Market Research Methodology
Key questions answered:
How feasible is Machine Learning in Finance market for long-term investment?
What are influencing factors driving the demand for Machine Learning in Finance near future?
What is the impact analysis of various factors in the Global Machine Learning in Finance market growth?
What are the recent trends in the regional market and how successful they are?
Thanks for reading this article; you can also get individual chapter-wise sections or region-wise report versions like North America, LATAM, Europe, or Southeast Asia.
News From
Category: Industry Reports & Market Analysis
 Profile: HTF Market Report is wholly owned brand of HTF market Intelligence Consulting Private Limited which provides next-generation service for organizations with a deep focus on market intelligence, data analytics, and social intelligence, all uniquely delivered under one roof by skilled professionals. By combining and analyzing acquire lucid and most relevant data which would help in better decision-making. We provide your requirements with speed and cost benefit across the world, we are able to achi ...
This email address is being protected from spambots. You need JavaScript enabled to view it.
For more information:"
2024-04-04 20:56:10,"Crypto Economy Rebounds With 2.13% Gain; Newcomers W, CORE, and ENA Face Downturns","The cryptocurrency market experienced a positive uptick on Thursday, reclaiming its position at $2.55 trillion, marking a... read full story "
2024-04-04 21:32:40,Racine County DA Hanson cites conflict of interest in alleged Steen campaign finance fraud case," RACINE, WI — The campaign finance fraud case against Adam Steen will need to be investigated by another jurisdiction after Racine County District Attorney Tricia Hanson informed the Wisconsin Ethics Committee she and her office may have a conflict of interest. 
Steen is alleged to have been involved in an illegal campaign finance scheme between former president Donald Trump’s campaign, several Wisconsin county Republican parties, and his campaign. 
Steen ran against Assembly Speaker Robin Vos in 2022 and lost by 260 votes. 
Sign up for daily newsletters from Racine County Eye. 
The Racine Co DA tells the state ethics committee says she has “a conflict that will prohibit myself, or my office” from charging or prosecuting Adam Steen, the GOP primary candidate who challenged Assembly Speaker Robin Vos in 2022 pic.twitter.com/iI1kzZU2Jc 
Matt Smith from WISN 12 News broke the story on X. The notice from Hanson to the WEC reads: 
I write to inform you, and the commission, that I am not able to proceed with charges involving campaign finance violations committed in Racine County by Adam Steen. After reviewing the case materials and contacting Ethics Counsel from the Wisconsin State Bar Association, I believe that I have a conflict that will prohibit myself, or my office, from prosecuting the campaign finance violations referred to me … “ 
Racine County Eye has messages into Hanson’s office for comment and will update this story if/when she returns our requests for comment. 
The case against Steen was referred to Hanson’s office by the WEC in February. She had 40 days to decide to bring charges and 60 days to prosecute before the WEC took their findings to the state Department of Justice. 
“Review of those materials will allow District Attorney Hanson to determine if additional investigation is needed, if a special prosecutor is needed, and if charges will be issued,” a press release from Hanson’s office read at the time. 
At the heart of the complaint are allegations that Trump’s campaign schemed with Rep. Janel Brandtjen (R-Menominee Falls) to illegally funnel donations over $1,000 to county Republican parties who sent the money to local campaigns, including Steen’s. 
Hanson’s inability to investigate Steen may come down to the simple fact that Hanson has made and accepted donations from Racine County Republicans, including Vos. 
A special prosecutor from a neighboring county such as Milwaukee or Kenosha will almost certainly be appointed to take the case. 
Racine County Eye will continue to update this story as details become available. 
The Racine County Eye and Kenosha Lens are committed to providing you with accurate, timely election information. We are your source for local news that serves our diverse communities. Subscribe today to stay up-to-date with the latest election coverage and other local news. 
Racine County Eye and Kenosha Lens – Journalism that serves. 
Support credible, community-based public service journalism. 
Thanks for your contribution!"
2024-04-04 18:50:27,Stock Market Today: Stocks Shed Gains Ahead of March Jobs Report – Yahoo Finance," Stock market today: Stocks give up gains ahead of March labor market reportYahoo Finance Market sentiment is changing as stocks fall and oil prices riseForexLive Stock Market Today: Dow, S&P Live Updates for April 4thBloomberg Middle East: Commodity markets give warning signal for the stock marketThe Australian Financial Review"
2024-04-04 22:49:24,Trousdale Ventures Celebrates Space Economy Portfolio Companies In New Appointments,"451: Unavailable due to legal reasons
We recognize you are attempting to access this website from a country belonging to the European Economic Area (EEA) including the EU which             enforces the General Data Protection Regulation (GDPR) and therefore access cannot be granted at this time.                              For any issues, contact news@joplinglobe.com or call (800) 444-8514 ."
