date,headline,description
2024-04-03 22:48:42,Bao Finance 1-Day Trading Volume Reaches $0.18 (BAO),"Bao Finance 1-Day Trading Volume Reaches $0.18 (BAO)
Posted by Hanz Christensen on Apr 3rd, 2024
Share on Stocktwits
Bao Finance ( BAO ) traded flat against the dollar during the 24 hour period ending at 18:00 PM E.T. on April 3rd. One Bao Finance token can now be bought for about $0.0000 or 0.00000000 BTC on popular exchanges. During the last seven days, Bao Finance has traded down 0.7% against the dollar. Bao Finance has a total market cap of $705,816.10 and approximately $0.18 worth of Bao Finance was traded on exchanges in the last 24 hours.
Here’s how similar cryptocurrencies have performed during the last 24 hours:
Get Bao Finance alerts:
KILT Protocol (KILT) traded up 1.8% against the dollar and now trades at $0.40 or 0.00000602 BTC.
Aidi Finance (BSC) (AIDI) traded down 2.2% against the dollar and now trades at $0.0000 or 0.00000000 BTC.
Zoo Token (ZOOT) traded down 2.2% against the dollar and now trades at $0.0652 or 0.00000239 BTC.
CareCoin (CARES) traded 2.2% lower  against the dollar and now trades at $0.0809 or 0.00000297 BTC.
Kitty Inu (KITTY) traded 1.9% higher  against the dollar and now trades at $95.84 or 0.00338062 BTC.
Hokkaidu Inu (HOKK) traded 1.2% higher  against the dollar and now trades at $0.0004 or 0.00000001 BTC.
Lego Coin (LEGO) traded flat against the dollar and now trades at $0.0086 or 0.00000013 BTC.
Jeff in Space (JEFF) traded down 2.2% against the dollar and now trades at $2.75 or 0.00010076 BTC.
Lumi Credits (LUMI) traded up 0.7% against the dollar and now trades at $0.0091 or 0.00000014 BTC.
AXIA Coin (AXC) traded down 0.1% against the dollar and now trades at $13.43 or 0.00048094 BTC.
About Bao Finance
Bao Finance was first traded on December 2nd, 2020. Bao Finance’s total supply is 560,270,974,250 tokens and its circulating supply is 34,066,471,176 tokens. Bao Finance’s official message board is thebaoman.medium.com . Bao Finance’s official Twitter account is @baocommunity and its Facebook page is accessible here . Bao Finance’s official website is www.baofinance.io .
According to CryptoCompare, “Bao (包) stands for a treasure or package. Something wonderful that is wrapped up in another layer. Bao buns, or in Chinese Baozi (包子) are delicious wrapped dumplings.
These bao buns are the tradition of taking something good that exists and wrapping it up into being a new treasure.
Bao Finance aims to do this by being a new protocol that adds features to existing DeFi systems.
The BAO token acts as a governance token for the fully community-run project. It is also backed by the insurance fund where all Bao fees go.”
Bao Finance Token Trading
It is usually not currently possible to purchase alternative cryptocurrencies such as Bao Finance directly using US dollars. Investors seeking to trade Bao Finance should first purchase Ethereum or Bitcoin using an exchange that deals in US dollars such as Changelly, Gemini or Coinbase . Investors can then use their newly-acquired Ethereum or Bitcoin to purchase Bao Finance using one of the exchanges listed above."
2024-04-03 22:48:43,XIDO FINANCE Price Down 3.4% Over Last Week (XIDO),"XIDO FINANCE Price Down 3.4% Over Last Week (XIDO)
Posted by Lindsey Winhoffer on Apr 3rd, 2024
Share on Stocktwits
XIDO FINANCE ( XIDO ) traded 12% higher  against the U.S. dollar during the 24-hour period ending at 18:00 PM Eastern on April 3rd. Over the last week, XIDO FINANCE has traded 3.4% lower  against the U.S. dollar. XIDO FINANCE has a market cap of $37.90 million and $174.82 worth of XIDO FINANCE was traded on exchanges in the last day. One XIDO FINANCE token can now be bought for about $1.34 or 0.00002026 BTC on cryptocurrency exchanges.
Here’s how other cryptocurrencies have performed over the last day:
Get XIDO FINANCE alerts:
KILT Protocol (KILT) traded up 1.8% against the dollar and now trades at $0.40 or 0.00000602 BTC.
Aidi Finance (BSC) (AIDI) traded 2.2% lower  against the dollar and now trades at $0.0000 or 0.00000000 BTC.
Zoo Token (ZOOT) traded down 2.2% against the dollar and now trades at $0.0652 or 0.00000239 BTC.
CareCoin (CARES) traded 2.2% lower  against the dollar and now trades at $0.0809 or 0.00000297 BTC.
Kitty Inu (KITTY) traded up 1.9% against the dollar and now trades at $95.84 or 0.00338062 BTC.
Hokkaidu Inu (HOKK) traded 1.2% higher  against the dollar and now trades at $0.0004 or 0.00000001 BTC.
Lego Coin (LEGO) traded flat against the dollar and now trades at $0.0086 or 0.00000013 BTC.
Jeff in Space (JEFF) traded 2.2% lower  against the dollar and now trades at $2.75 or 0.00010076 BTC.
Lumi Credits (LUMI) traded 0.7% higher  against the dollar and now trades at $0.0091 or 0.00000014 BTC.
AXIA Coin (AXC) traded 0.1% lower  against the dollar and now trades at $13.43 or 0.00048094 BTC.
XIDO FINANCE Token Profile
XIDO FINANCE launched on September 9th, 2020. XIDO FINANCE’s total supply is 100,000,000 tokens and its circulating supply is 28,314,463 tokens. XIDO FINANCE’s official message board is medium.com/@xidofinance . XIDO FINANCE’s official website is xido.finance . XIDO FINANCE’s official Twitter account is @xidofinance and its Facebook page is accessible here .
According to CryptoCompare, “XIDO is decentralized AMM with yield farming incentives, no mints, and a unique token distribution design. Token which adds a governance layer and powers the self-sustaining pools and farms without ever minting a new token.
It is layer protocol for payments specifically built to support the fast-growing DeFi industry using our important technological innovations.”
Buying and Selling XIDO FINANCE
It is usually not possible to buy alternative cryptocurrencies such as XIDO FINANCE directly using US dollars. Investors seeking to trade XIDO FINANCE should first buy Bitcoin or Ethereum using an exchange that deals in US dollars such as Gemini, GDAX or Coinbase . Investors can then use their newly-acquired Bitcoin or Ethereum to buy XIDO FINANCE using one of the exchanges listed above."
2024-04-02 13:24:12,Russian Finance Ministry to hold federal loan bonds auction on April 3,"Bids can be submitted via the Moscow Exchange or the St. Petersburg Currency Exchange MOSCOW, April 2. /TASS/. The Russian Ministry of Finance announces auctions for two issues of federal loan (OFZ) bonds. 
Fixed-income OFZ bonds of Issue 26242 mature on August 29, 2029 and indexed par value bonds of Issue 52005 mature on May 11, 2033 will be offered to investors, the ministry said. 
Bids can be submitted via the Moscow Exchange or the St. Petersburg Currency Exchange. 
Settlements under transactions made at the auction will be performed on the next business day."
2024-04-02 11:46:03,Investment in Moscow economy totals around $73.5 bln in 2023,"The largest portion of the total investment, 33.4%, went into machines and equipment, while another 28.2% was invested in non-residential construction and land improvement, Sergey Sobyanin said MOSCOW, April 2. /TASS/. Investment in the Russian capital’s economy rose by 3.8% last year in comparable prices compared with 2022 and reached around 6.8 trillion rubles ($73.5 bln), Moscow Mayor Sergey Sobyanin reported on his Telegram channel. 
”Investment in Moscow’s economy totaled around 6.8 trillion rubles last year, an increase of 3.8% in comparable prices compared to 2022,” he wrote. 
The largest portion of the total investment, 33.4%, went into machines and equipment, while another 28.2% was invested in non-residential construction and land improvement, Sobyanin said, adding that 16.5% and 18.8% were invested in research, development and innovation, as well as residential construction, respectively."
2024-04-03 23:04:41,Manifold Finance Price Up 42.4% This Week (FOLD),"Manifold Finance Price Up 42.4% This Week (FOLD)
Posted by Micah Haroldson on Apr 3rd, 2024
Share on Stocktwits
Manifold Finance ( FOLD ) traded up 23.5% against the US dollar during the twenty-four hour period ending at 18:00 PM E.T. on April 3rd. One Manifold Finance token can now be bought for about $31.46 or 0.00047825 BTC on cryptocurrency exchanges. During the last week, Manifold Finance has traded up 42.4% against the US dollar. Manifold Finance has a total market capitalization of $133.07 million and $350,890.96 worth of Manifold Finance was traded on exchanges in the last day.
Here’s how similar cryptocurrencies have performed during the last day:
Get Manifold Finance alerts:
KILT Protocol (KILT) traded 1.7% higher  against the dollar and now trades at $0.40 or 0.00000604 BTC.
Aidi Finance (BSC) (AIDI) traded down 2.2% against the dollar and now trades at $0.0000 or 0.00000000 BTC.
Zoo Token (ZOOT) traded down 2.2% against the dollar and now trades at $0.0652 or 0.00000239 BTC.
CareCoin (CARES) traded 2.2% lower  against the dollar and now trades at $0.0809 or 0.00000297 BTC.
Kitty Inu (KITTY) traded 1.9% higher  against the dollar and now trades at $95.84 or 0.00338062 BTC.
Hokkaidu Inu (HOKK) traded up 1.2% against the dollar and now trades at $0.0004 or 0.00000001 BTC.
Lego Coin (LEGO) traded flat against the dollar and now trades at $0.0086 or 0.00000013 BTC.
Jeff in Space (JEFF) traded down 2.2% against the dollar and now trades at $2.75 or 0.00010076 BTC.
Lumi Credits (LUMI) traded 0.8% higher  against the dollar and now trades at $0.0091 or 0.00000014 BTC.
AXIA Coin (AXC) traded 0.1% lower  against the dollar and now trades at $13.43 or 0.00048094 BTC.
Manifold Finance Token Profile
Manifold Finance’s launch date was May 27th, 2021. Manifold Finance’s total supply is 2,000,000 tokens. Manifold Finance’s official Twitter account is @foldfinance and its Facebook page is accessible here . The official website for Manifold Finance is manifoldfinance.com .
According to CryptoCompare, “Manifold is a multi-protocol middleware solution to improve connectivity between DeFi products.
YCabal creates a virtualized mempool (i.e. a MEV-relay network) that aggregates transactions (batching), such transactions include:
Users can opt-in and send transactions to YCabal and in return for not having to pay for gas for their transaction, Manifold Finance batch process it and take the arbitrage profit from it. Risk by inventory price risk is carried by a Vault, where Vault depositers are returned the profit the YCabal realizes.”
Manifold Finance Token Trading
It is usually not currently possible to purchase alternative cryptocurrencies such as Manifold Finance directly using U.S. dollars. Investors seeking to acquire Manifold Finance should first purchase Bitcoin or Ethereum using an exchange that deals in U.S. dollars such as Coinbase , Changelly or Gemini. Investors can then use their newly-acquired Bitcoin or Ethereum to purchase Manifold Finance using one of the exchanges listed above."
2024-04-03 23:36:44,Head to Head Comparison: Horizon Technology Finance (NASDAQ:HRZN) and BlackRock MuniHoldings New York Quality Fund (NYSE:MHN),"Head to Head Comparison: Horizon Technology Finance (NASDAQ:HRZN) and BlackRock MuniHoldings New York Quality Fund (NYSE:MHN)
Posted by Micah Haroldson on Apr 3rd, 2024
Share on Stocktwits
BlackRock MuniHoldings New York Quality Fund ( NYSE:MHN – Get Free Report ) and Horizon Technology Finance ( NASDAQ:HRZN – Get Free Report ) are both small-cap finance companies, but which is the better stock? We will compare the two companies based on the strength of their profitability, institutional ownership, valuation, earnings, dividends, analyst recommendations and risk.
Dividends
BlackRock MuniHoldings New York Quality Fund pays an annual dividend of $0.44 per share and has a dividend yield of 4.2%. Horizon Technology Finance pays an annual dividend of $1.32 per share and has a dividend yield of 11.7%. Horizon Technology Finance pays out -269.4% of its earnings in the form of a dividend.
Get BlackRock MuniHoldings New York Quality Fund alerts:
Earnings and Valuation
This table compares BlackRock MuniHoldings New York Quality Fund and Horizon Technology Finance’s revenue, earnings per share and valuation.
Gross Revenue
BlackRock MuniHoldings New York Quality Fund
N/A
($0.49)
-23.06
BlackRock MuniHoldings New York Quality Fund has higher earnings, but lower revenue than Horizon Technology Finance.
Analyst Ratings
This is a summary of current recommendations and price targets for BlackRock MuniHoldings New York Quality Fund and Horizon Technology Finance, as provided by MarketBeat.com.
Sell Ratings
BlackRock MuniHoldings New York Quality Fund
0
0
1.60
Horizon Technology Finance has a consensus price target of $10.80, suggesting a potential downside of 4.42%. Given Horizon Technology Finance’s  higher probable upside, analysts clearly believe Horizon Technology Finance is more favorable than BlackRock MuniHoldings New York Quality Fund.
Insider & Institutional Ownership
28.2% of BlackRock MuniHoldings New York Quality Fund shares are held by institutional investors. Comparatively, 4.9% of Horizon Technology Finance shares are held by institutional investors. 1.0% of BlackRock MuniHoldings New York Quality Fund shares are held by company insiders. Comparatively, 1.5% of Horizon Technology Finance shares are held by company insiders. Strong institutional ownership is an indication that hedge funds, large money managers and endowments believe a stock will outperform the market over the long term.
Volatility & Risk
BlackRock MuniHoldings New York Quality Fund has a beta of 0.52, suggesting that its stock price is 48% less volatile than the S&P 500. Comparatively, Horizon Technology Finance has a beta of 1.21, suggesting that its stock price is 21% more volatile than the S&P 500.
Profitability
This table compares BlackRock MuniHoldings New York Quality Fund and Horizon Technology Finance’s net margins, return on equity and return on assets.
Net Margins
7.77%
Summary
Horizon Technology Finance beats BlackRock MuniHoldings New York Quality Fund on 8 of the 10 factors compared between the two stocks.
About BlackRock MuniHoldings New York Quality Fund
( Get Free Report )
BlackRock MuniHoldings New York Quality Fund, Inc. is a closed ended fixed income mutual fund launched by BlackRock, Inc. It is managed by BlackRock Advisors, LLC. The fund invests in fixed income markets. It invests primarily in investment grade New York municipal obligations exempt from federal income taxes and New York State and New York City personal income taxes. BlackRock MuniHoldings New York Quality Fund, Inc. was formed on September 19, 1997 and is domiciled in United States.
About Horizon Technology Finance
( Get Free Report )
Horizon Technology Finance Corporation is a business development company specializing in lending and and investing in development-stage investments. It focuses on making secured debt and venture lending investments to venture capital backed companies in the technology, life science, healthcare information and services, cleantech and sustainability industries. It seeks to invest in companies in the United States.
Receive News & Ratings for BlackRock MuniHoldings New York Quality Fund Daily - Enter your email address below to receive a concise daily summary of the latest news and analysts’ ratings for BlackRock MuniHoldings New York Quality Fund and related companies with MarketBeat.com’s FREE daily email newsletter ."
2024-04-03 19:48:43,Wojak Finance (WOJ) Self Reported Market Cap Reaches $14.62 Million,"Wojak Finance (WOJ) traded up 1% against the dollar during the 1-day period
ending at 19:00 PM Eastern on April 3rd. Over the last seven days, Wojak Finance
has traded 6.1% lower against the dollar. Wojak Finance has a total market
capitalization of $14.62 million and approximately $1,641.51 worth of Wojak
Finance was traded on […]"
2024-04-03 23:48:43,Wojak Finance (WOJ) Self Reported Market Cap Reaches $14.62 Million,"Wojak Finance (WOJ) traded up 1% against the US dollar during the 24 hour period
ending at 19:00 PM ET on April 3rd. One Wojak Finance token can now be purchased
for $0.0030 or 0.00000005 BTC on major exchanges. Wojak Finance has a total
market cap of $14.62 million and approximately $1,641.51 worth of Wojak […]"
2024-04-03 14:56:37,The US Economy Will Continue To Decarbonize Even If Trump Is Elected," Bank of America 
CF Industries’ Donaldsonville Ammonia Production Facility Has Invested in Carbon Capture 
Myron Ebell, who headed the Environmental Protection Agency (EPA) transition team for Trump’s first term, says that should Donald Trump and the Republicans defeat President Biden in November’s election, they will seek to dismantle climate legislation. A core target will be the Inflation Reduction Act, the legislation filled with support for clean energy projects and electric vehicles. If you read news coverage and the statements of both prominent Republicans and Democrats, this is a common point of view. 
Andrew Obin, a managing director for equity research, begs to differ. He believes the US economy will continue to decarbonize no matter who is elected in November. In February, Mr. Obin spoke at ARC Advisory Group’s Industry Leadership Forum in Orlando. A central theme of the conference was energy transition and industrial sustainability. 
One reason for this is that public companies care about these issues. They must. According to Bank of America research, climate is the top reason why shareholders vote for proxies. A proxy allows an investor to vote without being physically present at the annual shareholder’s meeting. Shareholders are giving their proxies to parties they do care deeply about climate issues. 
BofA global equity research also suggests that US public companies will spend an extra $2.4 trillion over the next five years over what they were previously going to invest to meet net-zero targets. The energy sector will invest the most. It is projected to spend nearly $500 billion in extra capex during this time period. 
Industrial policy is part of the reason for these surges in investment. Before the Inflation Reduction Act and other pieces of legislation were passed, the US spent 0.4% of its GDP on industrial policy. It is now up to 0.8%, the highest among all Western economies. This stimulus peaks in 2026, but it will continue through 2031. 
Further, while the new legislation creates roughly $400 billion in subsidies, it creates $1 trillion in tax incentives! 
In the Energy sector, net zero can not be achieved without carbon capture and storage. The Inflation Reduction Act creates carbon capture tax credits that are worth $85 per ton of captured carbon. For CF Industries’ Donaldsonville Ammonia Production facility, these credits mean that a $200 million investment in carbon capture will lead to $100 million in benefits per year and those benefits will continue for several years. 
In short, the subsidies and tax credits create real opportunities for some of the industries most responsible for the increase in carbon in the atmosphere. 
However, the Inflation Reduction Act was passed without a single Republican vote in 2022. If Trump’s election also leads to a Republican majority in Congress, what will stop Congress from dismantling this bill? 
Jobs in the energy sector are primarily in the red states. The new carbon capture plants will create construction jobs, which will also be primarily in red states. It is one thing for Republicans to vote against the Inflation Reduction Act. It is quite another for these representatives to take jobs and investments out of their constituencies. “This legislation was cleverly designed,” Mr. Obin said. Many of the red state benefits are designed to be sticky. Republicans will not be able to kill tax subsidies.”"
2024-04-03 20:18:42,Tortoise Power and Energy Infrastructure Fund (NYSE:TPZ) vs. Portman Ridge Finance (NASDAQ:PTMN) Head-To-Head Review,"Tortoise Power and Energy Infrastructure Fund (NYSE:TPZ) vs. Portman Ridge Finance (NASDAQ:PTMN) Head-To-Head Review
Posted by Erica Schwartz on Apr 3rd, 2024
Share on Stocktwits
Tortoise Power and Energy Infrastructure Fund ( NYSE:TPZ – Get Free Report ) and Portman Ridge Finance ( NASDAQ:PTMN – Get Free Report ) are both financial services companies, but which is the superior business? We will contrast the two companies based on the strength of their profitability, institutional ownership, dividends, valuation, analyst recommendations, earnings and risk.
Profitability
This table compares Tortoise Power and Energy Infrastructure Fund and Portman Ridge Finance’s net margins, return on equity and return on assets.
Get Tortoise Power and Energy Infrastructure Fund alerts:
Net Margins
Tortoise Power and Energy Infrastructure Fund
N/A
6.19%
Analyst Recommendations
This is a summary of recent ratings and target prices for Tortoise Power and Energy Infrastructure Fund and Portman Ridge Finance, as reported by MarketBeat.
Sell Ratings
Tortoise Power and Energy Infrastructure Fund
0
0
2.00
Portman Ridge Finance has a consensus price target of $20.00, suggesting a potential upside of 4.44%. Given Portman Ridge Finance’s  higher possible upside, analysts clearly believe Portman Ridge Finance is more favorable than Tortoise Power and Energy Infrastructure Fund.
Insider and Institutional Ownership
30.1% of Portman Ridge Finance shares are held by institutional investors. 2.2% of Portman Ridge Finance shares are held by insiders. Strong institutional ownership is an indication that large money managers, hedge funds and endowments believe a stock will outperform the market over the long term.
Dividends
Tortoise Power and Energy Infrastructure Fund pays an annual dividend of $1.26 per share and has a dividend yield of 8.0%. Portman Ridge Finance pays an annual dividend of $2.76 per share and has a dividend yield of 14.4%. Portman Ridge Finance pays out 230.0% of its earnings in the form of a dividend, suggesting it may not have sufficient earnings to cover its dividend payment in the future. Portman Ridge Finance has raised its dividend for 2 consecutive years. Portman Ridge Finance is clearly the better dividend stock, given its higher yield and longer track record of dividend growth.
Valuation & Earnings
This table compares Tortoise Power and Energy Infrastructure Fund and Portman Ridge Finance’s top-line revenue, earnings per share (EPS) and valuation.
Gross Revenue
Tortoise Power and Energy Infrastructure Fund
$10.42 million
Portman Ridge Finance has higher revenue and earnings than Tortoise Power and Energy Infrastructure Fund.
Summary
Portman Ridge Finance beats Tortoise Power and Energy Infrastructure Fund on 9 of the 10 factors compared between the two stocks.
About Tortoise Power and Energy Infrastructure Fund
( Get Free Report )
Tortoise Power and Energy Infrastructure Fund, Inc. is a closed-ended balanced mutual fund launched and managed by Tortoise Capital Advisors, LLC. The fund invests in the fixed income and public equity markets of the United States. It invests in securities of companies operating in the power and energy infrastructure sectors. The fund employs a fundamental analysis with a bottom up stock picking approach with focus on factors like comparison of quantitative, qualitative, and relative value factors to create its portfolio. It was formerly known as Tortoise Power and Energy Income Company. Tortoise Power and Energy Infrastructure Fund, Inc. was formed on July 5, 2007 and is domiciled in the United States.
About Portman Ridge Finance
( Get Free Report )
Portman Ridge Finance Corporation is a business development company specializing in investments in unitranche loans (including last out), first lien loans, second lien loans, subordinated debt, equity co-investment, mezzanine, buyout in middle market companies. It also makes acquisitions in businesses complementary to the firm’s business. It primarily invests in healthcare, cargo transport, manufacturing, industrial & environmental services, logistics & distribution, media & telecommunications, real estate, education, automotive, agriculture, aerospace/defense, packaging, electronics, finance, non-durable consumer, consumer products, business services, utilities, insurance, and food and beverage sectors. The fund typically invests $1 million to $20 million in its portfolio companies. It provides senior secured term loans from $2 million to $20 million maturing in five to seven years; second lien term loans from $5 million to $15 million maturing in six to eight years; senior unsecured loans $5 million to $23 million maturing in six to eight years; mezzanine loans from $5 million to $15 million maturing in seven to ten years; and equity investments from $1 to $5 million. The fund targets the companies with EBITDA between $5 million and $25 million. While investing in debt securities, it invests in those middle market firms with EBITDA between $10 million and $50 million and/or total debt between $25 million and $150 million. It invests in minority, and majority or control equity positions alongside its private equity sponsor partners.
Receive News & Ratings for Tortoise Power and Energy Infrastructure Fund Daily - Enter your email address below to receive a concise daily summary of the latest news and analysts’ ratings for Tortoise Power and Energy Infrastructure Fund and related companies with MarketBeat.com’s FREE daily email newsletter ."
