date,headline,description
2024-04-04 11:30:22,"DOW LOOKS TO BREAK LOSING STREAK, LEVI STRAUSS POPS: YAHOO FINANCE LIVE","Dow looks to break losing streak, Levi Strauss pops: Yahoo Finance Live
Leer todo el artículo
4 de abril de 2024, 12:30 p. m.
En este artículo:
Inténtalo de nuevo más tarde.
Más contenido a continuación
Inténtalo de nuevo más tarde.
Más contenido a continuación
^DJI
LEVI
After notching three straight days of losses, the Dow Jones Industrial Average ( ^DJI ) is looking to push higher on Thursday. Today’s trading action will likely be influenced by a slew of Fedpseak this afternoon. One of the biggest movers on Wall Street is Levi Strauss & Co. ( LEVI ). The apparel company reported better-than-expected first quarter earnings and raised its full-year earnings outlook, sending shares soaring. Other trending tickers on Yahoo Finance include Tilray Brands ( TLRY ), Dell Technologies ( DELL ), and Ulta Beauty ( ULTA ).
Top guests today include:
9:05 a.m. ET - Doug Creutz, TD Cowen Managing Director
9:45 a.m. ET - Ronald Jewsikow, Guggenheim Securities Vice President – Automotive Equity Research
10:35 a.m. ET - David Lebovitz, J.P. Morgan Asset Management Managing Director & Global Market Strategist
10:45 a.m. ET - Matt Wood, AWS Vice President of AI Products
11:30 a.m. ET - Michael Bright, Structured Finance Association CEO
MÁS POPULARES
1.
ProColombia buscará atraer 162 nuevos proyectos de inversión extranjera en 2024
4.
Jeff Bezos se une a Bernard Arnault, la persona más rica del mundo, en el club de los US$ 200.000 millones
5.
Solicitudes semanales de subsidio de desempleo en EEUU aumentan más de lo previsto
WASHINGTON, 4 abr (Reuters) - El número de estadounidenses que presentaron nuevas solicitudes de subsidio de desempleo aumentó más de lo esperado la semana pasada, a medida que las condiciones del mercado laboral se relajan gradualmente. El Departamento de Trabajo informó el jueves que las solicitudes iniciales de subsidios estatales de desempleo aumentaron en 9.
hace 2 minutos
Así, se sumó a la lista de artistas que critican con dureza la gestión del presidente libertario
hace 4 minutos
En medio de la promoción del podcast ’Lab de la felicidad’, la conductora no pudo contener el llanto por una razón de peso.
hace 8 minutos
La conductora compartió este su testimonio de mujer a mujer.
hace 9 minutos
PR Newswire
IRBM publicará la gran eficacia contra tumores de los nuevos agentes preclínicos contra tumores cerebrales agresivos y la leucemia linfoblástica aguda en la AACR
IRBM, líder en el campo del descubrimiento de medicamentos, anunció hoy que revelará nuevos datos sobre dos de sus productos internos más prometedores en la Conferencia Anual de la American Association for Cancer Research, próxima a celebrarse en San Diego, del 5 al 10 de abril. Los datos revelarán información sobre los nuevos componentes desarrollados para tratar las necesidades básicas insatisfechas en el tratamiento del cáncer.
hace 10 minutos
People EN ESPAÑOL
Tras mostrar pruebas y hacer fuertes confesiones sobre lo vivido en el reality, la actriz se mostró llorando por algo que le sucedió más tarde.
hace 10 minutos
Sebastián, el hijo menor de Alfredo Adame, habla fuerte al respecto.
hace 12 minutos
Una serie de ataques coordinados causa 28 muertos en el sur de Irán
Teherán, 4 abr (EFE).- Una serie de ataques coordinados contra cuarteles de la Guardia Revolucionaria y dos comisarias de Policía se ha saldado este jueves con veintiocho muertos, diez de ellos miembros de las fuerzas de seguridad, en el sur de Irán.
hace 13 minutos
Pese a su juventud, Zoraya Ter Beek es una joven que ha decidido poner fin a su vida.
hace 15 minutos
Niurka Marcos lanzó una serie ataques en contra de Eva Daniela, novia actual de su ex Juan Osorio.
hace 15 minutos
Rusia y la OTAN, el antagonismo que puede desembocar en confrontación directa
Moscú, 4 abr (EFE).- El Kremlin advirtió hoy en el 75 aniversario de la OTAN que las relaciones entre Rusia y el bloque occidental se encuentran al borde de ”la confrontación directa” debido a la implicación de los países aliados en la guerra en Ucrania.
hace 16 minutos
Gobierno y oposición de Venezuela son las que deciden en resolución de conflicto: canciller noruego
CARACAS, 3 abr (Reuters) - El canciller de Noruega, Andreas Motzfeldt Kravik, de visita en Venezuela, dijo que es el gobierno y la oposición venezolana a los que les corresponde decidir el camino para la resolución de su conflicto, mientras urgió a conformar la comisión de verificación de acuerdos suscritos entre las partes, según un comunicado divulgado el miércoles. Kravik, cuyo país actúa como facilitador entre las partes, se reunió en Caracas con el canciller venezolano, Yván Gil, así como c
hace 17 minutos
María Caballero y Paco Delgado son parte fundamental de esta gran producción hollywoodense que pretende revivir un clásico del cine.
hace 18 minutos
Javier Aguirre vuelve a una final de la Copa del Rey 19 años después
Palma, 4 abr (EFE).- Javier Aguirre ha manejado con precisión el timón del Mallorca hasta conducirlo a la cuarta final de su historia en la Copa del Rey ante el Athletic Club de Bilbao, segunda para el técnico mexicano tras la que perdió hace 19 años, en 2005, con Osasuna en la prórroga (2-1) ante el Betis.
hace 18 minutos
EFE Latam
Simeone inicia sus pruebas: Morata en ataque, De Paul en el medio y Llorente de carrilero
Majadahonda (Madrid), 4 abr (EFE).- Diego Simeone, entrenador del Atlético de Madrid, ya enfoca al partido de ida de los cuartos de final de la Liga de Campeones del próximo miércoles contra el Borussia Dortmund, con Álvaro Morata en la delantera junto a Antoine Griezmann, Rodrigo de Paul en el medio y Marcos Llorente en el carril derecho.
hace 19 minutos
Finlandia prolonga de forma indefinida el cierre de la frontera con Rusia
HELSINKI, 4 abr (Reuters) - Finlandia prorrogará de forma indefinida el cierre de sus pasos fronterizos terrestres con Rusia y añadirá varios puertos a una lista en la que se prohíbe viajar desde su vecino oriental, según anunció el gobierno el jueves. Finlandia cerró sus fronteras terrestres con Rusia a fines del año pasado ante el creciente número de llegadas procedentes de países como Siria y Somalia.
hace 21 minutos"
2024-04-04 12:51:34,British Business Bank Extends ENABLE Funding Facility with Time Finance," The British Business Bank has agreed a facility increase that will provide £29.4m of funding to smaller UK businesses, through an existing ENABLE Funding transaction with independent specialist finance provider, Time Finance. 
The additional funding brings the total small business funding “available through the facility to £64.4m.” 
This further supports Time Finance in “growing its pipeline and its proportion of own-book origination, so that it can provide more asset finance to UK smaller businesses.” 
The initial transaction, agreed in March 2018, was “to provide £35m of funding.” 
This was used to significantly “expand Time Finance’s asset finance lending to businesses across the UK small business sector, primarily for those seeking hard asset finance – which includes equipment with robust residual values after a period of use.” 
The first £35m facility was “provided through Time Finance plc’s wholly owned subsidiary Time Hard Asset Finance Limited.” 
As part of the increase announced today, the ENABLE Funding facility “will be extended to Time Vendor Finance Limited (also a wholly owned subsidiary of Time Finance plc) to fund a broader range of assets, including soft assets.” 
This transaction also contributes to “the British Business Bank’s objective of driving sustainable growth by increasing the supply of finance and creating a more diverse finance market for UK smaller businesses.” 
James Roberts, Chief Financial Officer, Time Finance said: 
“Over the past five years we have developed a strong working relationship with the British Business Bank and I am delighted this will now be able to continue for the foreseeable future. The enhanced facility will enable Time Finance to provide UK businesses with further funding for their business-critical equipment in one of our more secured and key strategic growth areas.” 
Reinald de Monchy, Managing Director, Guarantee and Wholesale Solutions, British Business Bank said: 
“We’re very pleased to agree this facility increase with Time Finance, which will help them to provide a more diverse range of asset finance options to small businesses across the UK. We’re also excited to see the growth this will help stimulate across the sector through the ENABLE Funding programme.” 
Launched in 2014, the ENABLE Funding program “supports the British Business Bank’s key objective to drive sustainable growth and prosperity across the UK by supporting access to finance for smaller businesses.” 
The ENABLE Funding program warehouses newly originated finance receivables from participating originators. 
Once the portfolio has sufficient scale, it aims to “refinance a portion of its funding on the capital markets, helping smaller finance providers to tap into institutional investors’ funds.” 
Time Finance’s purpose is “to Help UK Businesses Thrive and Survive through the provision of flexible funding facilities. It offers a multi-product range for SMEs concentrating on Asset, Loan and Invoice Finance. While focused on being an ‘own-book’ lender, the Group does retain the ability to broke-on deals where appropriate, enabling it to optimize business levels through market and economic cycles.” 
The British Business Bank is “the UK government’s economic development bank. Established in November 2014, its mission is to drive sustainable growth and prosperity across the UK and to enable the transition to a net zero economy, by improving access to finance for smaller businesses. Its remit is to design, deliver and efficiently manage UK-wide smaller business access to finance programs for the UK government."
2024-04-04 12:52:31,Frax Finance’s Strategic Leap into the Cosmos Ecosystem," In a significant move for the DeFi space, Frax Finance has announced its expansion into the Cosmos ecosystem, partnering with Noble, the on-chain asset issuance blockchain. 
This partnership marks a pivotal step in bringing the FRAX stablecoin and its staked version, sFRAX, from Ethereum to the Cosmos network, known for its interoperability among approximately 80 blockchains. 
A Vision for Expansion and Adoption 
At the core of this expansion lies a vision to amplify the adoption of FRAX and sFRAX across a myriad of applications, from trading to savings, payments, and collateral. Noble’s successful integration, which includes a substantial USDC circulation supply of over $195 million, serves as a testament to the potential for seamless asset integration across major Cosmos chains like Osmosis, dYdX, Celestia, Sei, and Injective. This collaboration paints a picture of a more liquid and interoperable Cosmos ecosystem, offering a decentralized stablecoin alternative with a promising outlook for widespread adoption. 
Ambitious Targets and Roadmap 
Frax Finance‘s expansion is just the beginning; the company has set its sights on a lofty goal of reaching $100 billion in assets by 2026. This aspiration is part of a comprehensive “singularity roadmap” that aims to significantly increase the TVL in its layer 2 blockchain, Fraxtal. With a current TVL of $13.2 million, the roadmap outlines the introduction of new assets and the rejuvenation of a mechanism to share protocol revenue with stakers of its native tokens. This audacious vision strives to fully collateralize the FRAX stablecoin and boost yields on sFRAX. 
The Role of Noble in Frax Finance’s Strategy 
Noble emerges as a critical player in this strategic expansion, facilitating the issuance of native digital assets within the Cosmos ecosystem. This move not only brings FRAX and sFRAX within the interoperable Cosmos network but also follows Noble’s successful track record, evidenced by its integration of Circle’s USDC. Noble’s technology enables the integration of assets with major Cosmos chains, enhancing the liquidity and utility of FRAX and sFRAX across a wide range of applications. 
Frax (FXS) and Cosmos (ATOM) Chart Analysis 
Photo: TradingView 
The FXS chart depicts a slight recovery, with the price recently crossing above the 20-day EMA, indicating a potential shift in momentum. The positive momentum could also be the result of the expansion news. However, the 50, 100, and 200 EMAs remain overhead, suggesting that the asset is in a broader downtrend. The RSI at 64.86 points to increasing buying pressure, yet it’s not in the overbought territory, allowing room for upward movement. Traders might look for sustained price action above the 20 EMA for confirmation of a trend reversal while watching for resistance at the higher EMAs. 
Photo: TradingView 
The Cosmos chart indicates a consolidation phase, with the price hovering near the 20-day EMA. While there has been a recent uptick in anticipation of Frax integration into its ecosystem, the price remains below major EMAs, suggesting a bearish trend. The RSI at 57.07 signifies moderate buying interest that hasn’t reached overbought levels. Investors may look for a decisive break above the 20-day EMA for a bullish signal but should be cautious of resistance from higher EMAs. 
Overall, both tokens have shown minor positive momentum, which can be based on the anticipation of the integration news, which can facilitate future adoption for both projects. 
You have successfully joined our subscriber list."
2024-04-04 13:00:00,Taiwan’s earthquake preparedness saved a lot of lives — and prevented a catastrophe for the global tech economy,"From Taiwan to South Korea to Silicon Valley, some of the most important nodes in the global tech economy are in disaster-prone places. We accept credit card, Apple Pay, and Google Pay. You can also contribute via"
2024-04-04 12:59:07,Biden says U.S. economy is world's best. Trump calls it a 'cesspool.' Data is clear.,"President Joe Biden is fighting to convince Americans that the U.S. economy is the world’s best.
His opponent, Donald Trump, routinely claims the United States is a ”cesspool of ruin.”
By the numbers, Biden is correct: America’s economy is stronger than other developed nations.
U.S. President Joe Biden, delivers remarks on the U.S. economy and his administration’s effort to revive American manufacturing, during his visit in Flex LTD, a factory that makes solar energy microinverters, in West Columbia, South Carolina, U.S. July 6, 2023. 
Jonathan Ernst | Reuters
President Joe Biden is fighting to convince inflation-weary voters that the U.S. economy is healthy.
”America has the best economy in the world,” he told NBC’s Today Show on Monday, laying out an argument that is central to his reelection campaign.
America’s economic standing in the world is becoming an early flashpoint on the campaign trail, where former President Donald Trump routinely depicts the United States as a commercial wasteland.
”We are a nation whose economy is collapsing into a cesspool of ruin,” Trump shouted at a Georgia rally last month, ”whose supply chain is broken, whose stores are not stocked, whose deliveries are not coming.”
But the numbers paint a different picture, one more in line with Biden’s narrative of American economic dominance than Trump’s apocalyptic warnings.
U.S. gross domestic product was 2.5% in 2023, significantly outpacing that of other developed economies, according to a January report from the International Monetary Fund . The IMF projected that the U.S. will hold that lead in 2024, though it expects GDP to come down to 2.1%.
”The U.S. economy is leading the way for the global economy. It’s driving the global economic train,” Moody’s Chief Economist Mark Zandi told CNBC. 
Even as interest rates spiked, the labor market has stayed strong. In March, U.S. private companies added 184,000 jobs , payrolls processing firm ADP reported on Wednesday, well ahead of the Dow Jones estimate of 150,000 jobs. It is the fastest employment growth the U.S. economy has seen since July 2023.
The stock market has also made record gains over the past several months and housing values have soared, though they have now begun to decline as inventory improves.
Besides sticky high prices that are projected to cool in the coming year, Zandi said that the fundamentals of the current U.S. economy are nearly ideal: ”The economy is picture perfect. It’s hard to argue with it.”
’Policy and luck’
The U.S. economy’s recent outperformance is the result of several factors.
”It’s both policy and luck,” said economist Joseph Gagnon of the Peterson Institute for International Economics, a Washington think tank.
In response to the economic quake of the pandemic, the U.S. government injected roughly $4 trillion of stimulus into the economy to support individual households and businesses.
US Speaker of the House Nancy Pelosi (C) and Representatives Kevin McCarthy (L) and Steny Hoyer show the bill to the press after the House passed a $2 trillion stimulus bill, on March 27, 2020, at the US Capitol in Washington, DC
Alex Edelman | AFP | Getty Images
”We had more fiscal stimulus than any other country and that is part of the reason why the U.S. has recovered from the Covid depression better than any other country,” said economist Josh Gottbaum, a former White House and Treasury Department official in both Republican and Democratic administrations, currently a guest scholar at the Brookings Institution.
America’s stimulus safety net came with a hefty price tag, leaving the U.S. with a much larger budget deficit than other countries. But it also kept the economy afloat, by providing a cushion so that companies did not have to execute mass layoffs that might have spiraled into a recession.
That labor market resilience has stuck. The unemployment rate has remained below 4% for the past two years, even as the Federal Reserve has sharply raised interest rates.
The U.S. economy’s position on the global stage is also a product of its resilience in the face of geopolitical crises, and the unique setup of the American financial system.
As Russia’s invasion of Ukraine disrupted global energy and food prices, for example, the U.S. was not hurt as much as areas like Europe and Japan, which rely more heavily on Russian energy and food imports,.
”That’s the luck part,” said Gagnon.
The U.S. economy’s resilience is also a result of its unique debt structures.
Townhomes are under construction on July 19, 2023 in Mundelein, Illinois. 
Scott Olson | Getty Images
U.S. households were more insulated from spikes in global rates, because of the 30-year fixed-rate mortgage, which allowed households to lock in extremely low mortgage rates from the early days of the pandemic. That 30-year mortgage rate, which is mostly unique to the U.S. financial system, protected households as rates later heated up.
”Our banking system takes a lot of interest rate risk, but in the rest of the world, they shove it on to the household, on to businesses,” said Zandi. ”That was really important this go around.”
Not ’free and clear’ yet
Even as the U.S. economy stays ahead of the rest of the developed world, there is still room for setbacks in the recovery.
”I don’t think we can conclude that we’ve soft landed, that we’re free and clear,” said Zandi.
Though inflation has fallen sharply from its 2022 highs, it has ticked back up in the past several months.
For now, the Federal Reserve remains hawkish on interest rates, despite previous indications the central bank would issue three cuts this year.
”On inflation, it is too soon to say whether the recent readings represent more than just a bump,” Federal Reserve Chair Jerome Powell said Wednesday.
watch now
VIDEO7:1907:19"
2024-04-04 13:10:13,Vinivia Launches App Shaping the Future of the Creator Economy Through an Interactive Live Streaming Experience,"THE LOS ANGELES-BASED COMPANY INTRODUCES THE VINIVIA CREATOR COMMUNITY WITH
EXCLUSIVE EVENT AT OPTIMIST STUDIOS
Vinivia, the cutting-edge live streaming app, is set to make its highly
anticipated debut in the U.S market through the launch of its app and Vinivia
Creator Community, with the first and exclusive 600 participating creators who
will have access to advanced technology that allows them full ownership of their
content and the highest revenue share in the market.

“We are beyond thrilled to bring this innovative, interactive and
top-of-the-line app to the market. At Vinivia, we believe in empowering creators
and fostering meaningful connections between content creators and their
audience. With Vinivia, creators have the tools and support they need to thrive
and become the next star of tomorrow. We’re incredibly proud of the end result,
and we know Vinivia will drive the creator economy forward significantly,” said
Co-Founder and CEO,Stefan Graf.

Marketing Technology News:unitQ Adds Product Analytics To Its User Feedback
Platform For Real-Time Actionable Insights Into What Users Are Doing And Saying


“Our app is designed for creators, by creators, offering transparency over
monetization models and providing creators with up to 80% of total revenue
generated from their content, which they fully own, allowing them to monetize
their passions,” added Co-Founder and CFO,Marcello Genovese.

Vinivia is poised to revolutionize the live streaming landscape with its
innovative features and pro-creator ethos.The Vinivia Creator Community is a
program for creators to have a direct partnership with the brand to maximize
revenue potential, monetize content, and unlock more revenue through unique
monetization tools. Vinivia’s advanced app features AI-powered content
suggestions for an improved user experience, flexible creator revenue share, and
under two second latency, with AR advertising technology that seamlessly
integrates products into creators streaming content.

Marketing Technology News:MarTech Interview with Frank Paterno, SVP of Marketing
at GlobalMeet

To celebrate the launch, Vinivia is hosting the inaugural Vinivia Awards, a live
streaming extravaganza event inLos Angelesat Optimist Studios, this evening. The
event will recognize top creators in categories such as Live Streamer of The
Year, Most Creative Live Streamer, and Best Newcomer Live Streamer, with a
$10,000grand prize awarded to each winner. The awards ceremony will be live
streamed on the Vinivia app for all consumers to follow along in real-time.

Content creators are encouraged to become early adopters and join as Vinivia
creators, gaining access to a supportive community and innovative tools to
showcase their talent.

Vinivia was founded in 2020 byStefan GrafandMarcello Genovese. Vinivia’s
visionary founders bring a wealth of expertise and success from their previous
tech ventures where they pioneered interactive broadcasting and live streaming
solutions that caught the eye of industry giants Meta and YouTube. Now with
Vinivia, Graf and Genovese are once again at the forefront of innovation,
setting their sights on an ambitious goal – revolutionizing the way users
connect, share, and engage through live streaming.

WRITE IN TOPSEN@ITECHSERIES.COM TO LEARN MORE ABOUT OUR EXCLUSIVE EDITORIAL
PACKAGES AND PROGRAMS."
