date,headline,description
2024-04-03 10:29:31,U.S. Chamber of Commerce Announces Small Business Owner Confidence in the Economy Ticks Up in First Quarter of 2024," April 3, 2024 - Washington, D.C. — The Q1 MetLife and U.S. Chamber of Commerce Small Business Index, which measures small business owner confidence, is 62.3—similar to last quarter’s score of 61.3—reflecting a stable business climate. More small businesses see an improving economy, helping to drive the headline score up one point.  
One in three (32%) small business owners now say the U.S. economy is in good health, up seven percentage points from last quarter. Roughly two in five (38%) say their local economy is in good health, up eight percentage points from the end of 2023.   
“Small businesses’ perceptions of the economy are drifting upward, with businesses reporting being comfortable with their cash flow and the health of their business,” said Tom Sullivan, Vice President of Small Business Policy at the U.S. Chamber of Commerce. “While many business owners have continued to struggle with high prices and rising wages, recent jobs reports are positive. While headwinds remain, confidence is ticking upward and small businesses are more resilient and prepared for unforeseen challenges.” 
Most small businesses are reporting consistent, high satisfaction with the state of their cash flow and business health. About two-thirds of small businesses say the overall health of their business is good (65%) and that they are comfortable with their current cash flow (67%). 
Overall perception of the economy remains muted: nearly half of small businesses continue to feel the economy is in poor health. Small businesses remain concerned about inflation—this is the seventh consecutive quarter that over half (52%) of small businesses cite inflation as a top challenge. In addition, concern for revenue rose seven percentage points this quarter with 29% saying revenue is a top challenge, returning to a level of concern last recorded in late 2021. 
“It is encouraging to see the majority of small business owners are satisfied with their business’s health and their current cash flow, despite ongoing concerns around inflation,” says Cynthia Smith, SVP, Head of Regional Business at MetLife. “These trends convey a sense of optimism for the future and, once again, underscore the adaptability and determination shown by small business owners in challenging economic environments.” 
Cybersecurity and supply chains are top threats   
This quarter’s survey also asked small businesses about their concern for future threats and crisis planning in response to those threats. Small businesses say they are most concerned about:   
Overall, most (71%) small businesses say they are adequately prepared for future threats. Most (80%) also say they have a clear idea of how to change their business if it starts to struggle—up 13 percentage points from Q4 2020 (67%), but six points under Q2 2018 levels (86%).   
Though these topline numbers indicate most small businesses feel prepared to handle what comes their way, across the board, most say they are only somewhat prepared to deal with them, rather than very prepared.   
For example, 23% say they are very prepared for cybersecurity threats, versus 50% who feel somewhat prepared. The gap is even larger in preparedness for a supply chain breakdown (14% very prepared, 47% somewhat prepared).     
To address a range of potential threats, small businesses are contributing to rainy-day funds (62%), installing surveillance precautions (56%), training staff on cybersecurity measures (48%), establishing formalized plans for future threats (43%), taking out insurance in case of natural disaster (38%), and building out existing supply chains (35%).   
“Fortunately, we don’t worry too much about natural disasters in Chicago, but cybersecurity is another story. We have taken several steps to boost security,” says Philip Preston, president of PolyScience in Niles, Illinois. “This includes daily offsite backup, two factor authentication for remote access, contracting an outside firm to test our cybersecurity monthly, and purchasing cyber insurance.” 
About the Small Business Index     
The MetLife and U.S. Chamber of Commerce Small Business Index is part of a multiyear collaboration by MetLife and the U.S. Chamber to elevate the voice of America’s small business owners and highlight the important role they play in the nation’s economy. The quarterly Index, an online survey of approximately 750 small business owners and decision makers, is designed to take the temperature of the sector, see where small business owners are confident, and where they are experiencing challenges.   
The Q1 2024 survey was conducted January 26 – February 12, 2024. The survey has a credibility interval of plus or minus 4.4 percentage points for all respondents. 
About the U.S. Chamber of Commerce     
The U.S. Chamber of Commerce is the world’s largest business organization representing companies of all sizes across every sector of the economy. Our members range from the small businesses and local chambers of commerce that line the Main Streets of America to leading industry associations and large corporations.     
They all share one thing: They count on the U.S. Chamber to be their voice in Washington, across the country, and around the world. For more than 100 years, we have advocated for pro-business policies that help businesses create jobs and grow our economy.     
About MetLife    
Source: U.S. Chamber of Commerce"
2024-04-03 16:57:19,Annual inflation in Russia accelerates to 7.62% over week — Economy Ministry,"Inflation in the consumer market slowed down to 0.1% MOSCOW, April 3. /TASS/. Annual inflation in Russia accelerated from 7.61% a week earlier to 7.62% from March 26 to April 1, the Ministry of Economic Development said in its price review. 
”Inflation in the consumer market slowed down to 0.1%; the price growth rate year on year totaled 7.62%,” the ministry said. 
”In the food segment, the rise in prices decelerated to 0.07%. Price growth rates for foods, except vegetables and fruits, slowed down (0.12%); the price decline continues for fruits and vegetables. Inflation for non-foods remained at the last-week level during the reporting week. Prices changed by 0.24% in the services sector. Domestic airfare prices continued going down,” the ministry informed."
2024-04-03 15:20:46,Russian public debt will be slightly below 17% of GDP by year’s end — finance minister,"Anton Siluanov noted that half of the public debt consists of loans on floating interest rates MOSCOW, April 3. /TASS/. Russia’s public debt is at a low level and at the end of the year it can even be slightly below 17% of GDP, Finance Minister Anton Siluanov told reporters on the sidelines of the State Duma, the lower house of parliament. 
”Indeed, our public debt is not high. Today the Prime Minister spoke about 17% of GDP. I think that, perhaps, by the end of the year it will be even a little lower. We are very careful about this indicator, since servicing costs are also rising amid the growth of interest rates,” the minister said. 
According to him, half of the public debt consists of loans on floating interest rates. 
”The Finance Ministry always treats money and borrowings carefully, so the issue of the budget rule is fundamentally important for us,” he stressed."
2024-04-03 15:06:03,Finance Ministry expects to fulfil plant on replenishing National Wealth Fund this year,"Anton Siluanov noted that ”most of the funds from the National Wealth Fund have been invested and will be allocated to key projects that ensure economic growth” MOSCOW, April 3. /TASS/. The Finance Ministry expects that the plan to replenish the National Wealth Fund (NWF) in 2024 will be fulfilled, most of it will be used to finance investment projects, Finance Minister Anton Siluanov told reporters. 
”We expect that we will fulfill those set levels of replenishment of the National Wealth Fund, which today is about 1.6 trillion rubles ($17.4 bln) in conditions of current estimates for this year. The three-year budget provides for replenishment of the National Wealth Fund, we have identified key investments from the National Wealth Fund,” the minister said. 
”The majority of the National Wealth Fund - a little less than 10 trillion rubles ($108 bln) - has either been invested or earmarked for those infrastructure projects for technological development that the Prime Minister spoke about today. Therefore, most of the funds from the National Wealth Fund have been invested and will be allocated to key projects that ensure economic growth,” Siluanov said. 
Earlier, the Finance Ministry reported that as of April 1, 2024, the volume of the National Wealth Fund amounted to 12.53 trillion rubles ($136 bln) (about 7% of Russia’s GDP forecast for 2024) against 12.26 trillion rubles ($133 bln) as of March 1. The volume of liquid assets of the National Wealth Fund as of April 1 amounted to 5.088 trillion rubles ($55 bln) (2.8% of the forecast GDP for 2024)."
2024-04-04 07:50:43,Frax Finance Expands to Cosmos Ecosystem Via Asset Issuance Chain Noble,"The Frax token (FRAX), a crypto-collateralized stablecoin pegged to the U.S. dollar, and its staked version, sFRAX, will become native to the Cosmos ecosystem via Noble. ...... read full story "
2024-04-03 22:13:09,Why is there nostalgia for the Trump economy in the battleground states?," Former President Donald Trump speaks during a campaign event in Green Bay, Wisconsin, on April 2, 2024. 
Daniel Steinle/Bloomberg/Getty Images 
A version of this story appeared in CNN’s What Matters newsletter. To get it in your inbox, sign up for free here. 
Voters and economists seem to have wildly different views of the US economy, a disconnect that’s hurting President Joe Biden in the key states that will decide the 2024 election. 
There’s new polling from The Wall Street Journal that outlines the dichotomy and the challenge it represents for Biden in particular as memories of the Donald Trump years fade. 
Perceptions vs. data 
Swing state voters, according to the Journal, are more focused on the economy and inflation than those nationwide, and they also have a dimmer view of the state of the country. 
Just one-quarter of registered voters in these seven key states – Arizona, Georgia, Michigan, North Carolina, Nevada, Pennsylvania and Wisconsin – say the economy has improved in the past two years. The economic data, on the other hand, suggests inflation is cooling and the US seems likely to avoid a recession that seemed likely a year ago. The soft landing happened without even spiking the unemployment rate, which was a real fear. 
“A relatively strong economy” is how Larry Summers, the former Treasury secretary, described it last month. For context, Summers was early to raise the alarm about the threat of inflation after the Covid-19 pandemic, and he has loudly criticized the Biden administration and the Federal Reserve for most of Biden’s term. 
The US economy vs. your state economy 
The disconnect runs much deeper than a misalignment of voters’ perceptions and economic indicators. About half of these voters think their own economic situation is fine, and they might rate their individual states as positive. The national economy, however, gets a bad rating. 
From the Journal: 
In North Carolina, for example, voters describe the national economy in negative rather than positive terms by 66% to 33%. Yet those numbers are reversed when asked to rate the state’s economy. In Wisconsin, negative views of the national economy outweigh positive ones by 16 points, while positive views of the state economy outweigh negative ones by 17 points. 
Across these battleground states, 46% of registered voters said their personal financial situation is headed in the right direction. 
Why the disconnect? 
The divide between Americans’ views of their personal finances and their broader economic sentiments isn’t new. CNN’s polling editor Ariel Edwards-Levy pointed me to Gallup polling from last April in which just 16% rated the economy as good or excellent, but 45% said their personal finances were good or excellent. (Perceptions of the economy have improved modestly in the intervening year.) 
Edwards-Levy also noted that partisanship can play a role in even seemingly non-political questions about the state of the nation. 
“People’s answers to surveys are often intended at least partially as an expression of partisan support or opposition,” she said, adding that is “compounded when talking about broad national trends.” 
Many may feel left behind 
It’s also true that while people might say in a survey that their financial situation is fine, there are indications that they also feel unable to keep up. 
Just read CNN’s reporting about tenants who can’t afford to pay their rents, the barriers to home ownership that are compounded on racial minorities or the issue with 401(k) balances. 
Stock markets may have repeatedly set records this year, making people with investments feel flush, but only about a quarter of registered voters across the swing states surveyed by the Journal said the ability for the average person to get ahead is moving in the right direction in the US. 
The ‘once people start to focus’ argument 
Biden’s task with this election cycle will be to convince these voters that their personal and state situation is writ large in the country too. 
As it stands, roughly half or more of registered voters in all of the swing states in the new Wall Street Journal poll say Trump is the candidate best able to handle the key issues of the economy, inflation and immigration. 
Biden’s supporters say the public will come around as the election nears. 
“You know what, once people start to focus in, and they see their two choices, it’s obvious that Joe will win this election,” first lady Jill Biden said on CBS on Wednesday morning. 
She disputed the Journal poll, which shows Trump holding a small lead in Arizona and North Carolina and matchups within the margin of error in the other five states. When potential independent or third-party candidates like Robert F. Kennedy Jr. are added to the question, Trump still leads by a narrow margin in Arizona and North Carolina, with no clear leader in the other states. 
“He’s coming up,” Jill Biden said of the president, indicating he would rise in polls. 
It’s certainly true that there’s a lot of campaigning left to do and a lot of time for developments between now and November. 
Will a campaign sell voters on Biden’s economy? 
On Wednesday, the president joined the progressive, independent Sen. Bernie Sanders of Vermont at the White House to brag about Democrats’ efforts to contain prescription drug prices. 
Biden said that by allowing Medicare to negotiate for certain prescription drugs, he and Sanders “beat Big Pharma finally.” Insulin is now capped at $35 for Medicare enrollees, for instance. 
Most voters probably haven’t yet gotten the message about beating Big Pharma. More than half of US adults nationwide said they worry about being able to afford prescription drugs, according to a KFF poll released in February. 
Presidential favorability ages well 
George W. Bush’s favorability rating was an objectively abysmal 35% when he left office in January 2009, according to CNN polling at the time. Nine years later, as Americans lived through the next Republican presidency – Trump’s – Bush’s favorability rating had completely rebounded. With the Iraq War and the Great Recession in the rearview mirror – and with Bush, unlike Trump, out of politics – 61% of Americans had a favorable view of him. 
Trump’s approval rating may have partially rebounded even though he is still very much in the political mix. More than half the country thought Trump should be removed from office after the January 6, 2021, insurrection, according to CNN polling at the time. His approval rating was just 34%. In the years since, as the shock of the attack on the US Capitol has faded and voters came to associate Biden with the White House and the trying years of the pandemic, views of Trump in hindsight have improved. 
Now, more than half of registered voters in the Wall Street Journal poll of battleground states said they either strongly or somewhat approve of the job Trump did as president. That blur of hindsight is a huge advantage for Trump. Just 38% of registered voters in the Journal poll said they either strongly or somewhat approve of the job Biden is doing as president. 
Biden is neck-and-neck with Trump among registered voters in those seven swing states on the question of protecting democracy. That should stun the White House since Biden has made protecting democracy, both in the US and abroad, the central tenet of his entire presidency."
2024-04-04 08:26:43,A Long Time in Finance: GEC/Marconi goes from bellwether to basket case,"A Long Time in Finance: GEC/Marconi goes from bellwether to basket case
April 4, 2024
GEC was a British manufacturing titan; a cash-rich producer of everything from washing machines to railway trains. Then in a few years, it rebranded and restructured, shedding most of the old industrial bits to focus on telecoms. The result? By 2005, shiny new Marconi was no more. In the second of their Fallen Angel series, Neil Collins and Jonathan Ford talk to industrial historian Nick Comfort about one of the most abrupt collapses in UK corporate history and its heavy industrial cost.
By loading the tweet, you agree to Twitter’s privacy policy.
Load tweet
Always unblock Twitter Tweets
Presented by Jonathan Ford and Neil Collins, with Nicholas Comfort. Produced and edited by Nick Hilton for Podot, in association with Briefcase.News.
Become a member for just £8/month to get unlimited access to the site. Sign in or Subscribe .
More Podcasts"
2024-04-04 08:48:44,Yellen eyes valuable asset on China trip: Insight on economy,U.S. Treasury Secretary Janet Yellen and her team are hoping their second visit to China in nine... read full story 
2024-04-04 08:58:32,"Bank of Japan offers bleaker view on economy, flags upbeat wage signs","TOKYO, April 4 (Reuters) - The Bank of Japan cut its economic assessment for seven of the country's nine regions on Thursday, but said the economies were mostly picking up or recovering gradually ..."
