date,headline,description
2024-03-29 19:09:16,Powell: ‘No reason’ to think economy is close to recession," Federal Reserve Chair Jerome Powell said Friday that there is “no reason” to think the U.S. economy is close to a recession. 
“Growth is strong,” Powell said at a conference in San Francisco. “As I mentioned, the economy is in a good place. There is no reason to think the economy is in a recession or is at the edge of one.” 
The U.S. economy has largely defied expectations over the past year and a half, avoiding the recession that many economists were anticipating at the end of 2022. 
In what many experts have declared a “soft landing,” inflation has come down significantly without triggering a major economic downturn. After peaking at 9.1 percent in June 2022, one measure of inflation, the consumer price index (CPI), has since fallen to 3.2 percent. 
The labor market has also remained surprisingly resilient in the face of repeated interest rate hikes by the Fed as the central bank has attempted to tamp down inflation. 
The economy added 275,000 jobs in February while the unemployment rate sat at 3.9 percent, continuing the longest sub-4 percent streak since the late 1960s. 
At its latest meeting earlier this month, the Fed opted to hold its baseline interest rate steady once again at a range of 5.25 to 5.5 percent, where it has remained since last summer. Powell has maintained that the central bank needs to see more “good” data before cutting rates. 
“Inflation has eased substantially while the labor market has remained strong. And that is very good news,” Powell said at a press conference last week. “But inflation is still too high. Ongoing progress in bringing it down is not assured. And the path forward is uncertain.” 
A separate inflation gauge closely monitored by the Fed, the personal consumption expenditures (PCE) price index, showed a slight uptick last month, according to new data released Friday. 
Prices rose 0.3 percent over the previous month and 2.5 percent year-over-year in February, the data showed. 
However, Powell said Friday that the latest numbers were “pretty much in line with our expectations,” emphasizing that the Fed still expects inflation to gradually “come down on a sometimes bumpy path.”"
2024-03-29 19:54:15,Top Fintech App Development Companies Listed: Revolutionizing Finance with Mobile Technology,"TopDevelopers.co has compiled a list of the finest Fintech application
development companies to assist finance corporations in developing the best
business solutions for growth.

{loadads}

In an era where digital transactions reign supreme and consumer preferences lean
heavily towards mobile accessibility, businesses in the finance sector are
turning to mobile apps to streamline operations, enhance customer experiences,
and stay ahead of the competition. The benefits of leveraging mobile technology
in the finance industry are manifold, offering unparalleled convenience,
efficiency, and security to users worldwide.

The finance industry is witnessing a transformative wave powered by technology,
and at the forefront of this revolution are mobile applications. As businesses
increasingly recognize the pivotal role of technology in finance, the demand for
professional fintech app development companies has surged, driving a flourishing
market of fintech app development.

As businesses across the globe navigate the complexities of the digital age and
seek to capitalize on the immense opportunities presented by fintech, the role
of expert finance app developers becomes increasingly paramount. Fintech apps
serve as catalysts for innovation in the finance industry, driving the
development of new financial products, services, and business models that cater
to evolving consumer needs and preferences.

In order to help businesses in maintaining a competitive edge in today's dynamic
landscape, TopDevelopers.co has curated a selection of finest Fintech app
development companies. These companies play a crucial role in driving
innovation, nurturing growth, and molding the future of finance through mobile
technology.

List of top fintech app developers

ScienceSoft

Vention

Saigon Technology

B2C Info Solutions

Orangesoft

Designli

Binmile Technologies

UppLabs

Code & Pepper

Northell

About TopDevelopers

As a dedicated directory of B2B IT service providers - TopDevelopers.co
understands that finding a trustworthy and good mobile app development company
can be time consuming as well as tiresome. We, as a reputed research and
analysis platform, act as a bridge between the organizations and the mobile app
development companies for a smooth initiation of the mobile app development
process.

{loadads}

{loadmtreelistings 55301}"
2024-03-29 20:08:08,How to Manage Family Finances When Costs Feel Unmanageable,"Parents is part of the Dotdash Meredith  publishing family.
Newsletter Sign Up
Newsletter Sign Up
We Care About Your Privacy
We and our 100 partners store and/or access information on a device, such as unique IDs in cookies to process personal data. You may accept or manage your choices by clicking below, including your right to object where legitimate interest is used, or at any time in the privacy policy page. These choices will be signaled to our partners and will not affect browsing data.
We and our partners process data to provide:
Store and/or access information on a device. Use limited data to select advertising. Create profiles for personalised advertising. Use profiles to select personalised advertising. Create profiles to personalise content. Use profiles to select personalised content. Measure advertising performance. Measure content performance. Understand audiences through statistics or combinations of data from different sources. Develop and improve services. Use limited data to select content.
List of Partners (vendors)"
2024-03-29 20:36:24,"Oakland Athletics |
A’s pitcher Stripling had backup plan in personal finance before MLB career took off","March 29, 2024 at 1:36 p.m.
| UPDATED:
March 29, 2024 at 1:36 p.m.
MESA – Ten years ago, Ross Stripling was sitting at home unable to pitch, wondering if Tommy John elbow surgery had derailed his career.
Stripling, then 24, was a promising prospect fighting to earn a spot as the Los Angeles Dodgers’ No. 5 starter after coming off a season with a 2.82 earned run average in 127.2 innings between High-A and Double-A.
During that recovery time, Stripling, who is scheduled to start tonight for the Oakland A’s against the Cleveland Guardians, made strides toward a backup plan if his playing career didn’t pan out – working in personal finance.
The Texas A&M graduate with a degree in business finance did not originally plan to go down that route.
After growing up in Southlake, Texas, Stripling enrolled at A&M for its highly esteemed engineering program. After a while, he decided to switch gears and pursue a finance degree. He said he enjoyed the way finances looked toward the future instead of the past.
The initial interest came from his family. Through the years, Stripling slowly gained knowledge from both of his grandfathers who actively invested in the stock market.
“I just learned about it from talking to them and picking their brains,” he said. “I invested my own signing bonus (of $130,000) when I signed. Not that it was anything crazy, but that kind of got my feet wet with investing.”
It all came together when Stripling was sidelined for the 2014 season and started making progress toward securing his financial licenses.
“The guy that my mom’s dad invested with in Houston just kind of fielded a call from my grandfather saying, ‘Hey, my grandson has a lot of free time on his hands right now. He’s maybe looking for a fallback plan if baseball doesn’t work. Do you have anything for him?’’’ Stripling said.
“I didn’t know what to expect. I walk in, like all dressed up and have no idea what to expect, and he’s just like, ‘You know, the best thing I can do is probably get you licensed. You’d have to take your Series 7 (General Securities Representative Exam) and (Series) 66 (Uniform Combined State Law Exam) to make you a licensed money manager.’”
The plan was for Stripling to go back to baseball and, whether he was successful or not, build a network of potential clients.
Stripling, who arrived to the A’s in a February trade with the Giants, has followed through on that objective. From his debut in 2016 to the present day, Stripling has worked with a variety of people and still actively manages 11 accounts.
Of course, baseball has worked out well for Stripling, a former All-Star: He has earned nearly $36 million in his career and is the A’s top-earning player at $9.25 million (plus $3.25 million from the Giants).
Related Articles
What needs to go right for Oakland A’s to have successful season on the field in 2024
The issue of professional athlete money management is not new. Fifteen years ago, Sports Illustrated published a groundbreaking story that, through interviews with players, agents and others, reported 78 percent of former NFL players had gone bankrupt or were under financial stress within two years of retirement and 60 percent of NBA players were broke within five years of retirement.
And former major leaguer Jody Gerut estimates that 70 percent of foreign-born Latino players in MLB endure financial hardship within four years of retirement.
Stripling believes baseball players are generally pretty good with money. Those with large signing bonuses often seek professional advice right away, while lower-round picks look for instruction immediately on how to budget in order to survive.
In his eight years at the major league level, he has guided many of his teammates: Top-level pros may make large yearly sums, but most athletes have relatively short careers, so financial literacy is important.
“I’ve actively tried to make sure that people are aware that I have that skill set,” Stripling said. “I’ve definitely tried to make sure that there’s an open line of communication with me and a lot of guys pick my brain.”"
2024-03-29 20:51:00,"DeepBrain AI with Estonian Ministry of Economy, Information and Communication discusses introduction of AI human Public Service"," PALO ALTO, Calif., March 29, 2024 /PRNewswire/ -- DeepBrain AI (CEO Se-young Jang), a domestic company specializing in generative artificial intelligence (AI), announced on the 22nd that we met with a visiting delegation from the Estonian Ministry of Economy, Information and Communication to discuss ways to apply AI human in local public services. 
This discussion took place when a visiting delegation from the Estonian Ministry of Economy, Information and Communication, who came to Korea to attend the 3rd Democracy Summit held in Seoul, visited Deep Brain AI headquarters in Gangnam-gu, Seoul on the 20th. This visit was made possible after the Estonian Minister of Economy, Information and Communication’s office directly requested a meeting with Deep Brain AI from the local business office. 
The Estonian Ministry of Economy, Information and Communication is seeking to improve the competitiveness of public services by introducing a virtual assistant using AI technology at its affiliated organization, the Information Systems Agency of Estonia (RIA). In keeping with the trends of the times, the plan is to use AI technology to build a system where the country and citizens can communicate freely. 
As part of this, the Estonian visiting delegation, including Estonian Minister of Economy, Information and Communication Tit Lysalo and Estonian Ambassador to Korea Sten Schwede, held detailed discussions on AI human technologies applicable to RIA, including the introduction of virtual assistants. 
DeepBrain AI introduced the company and demonstrated AI human technology and various services using it, and the visiting delegation from the Estonian Ministry of Economy, Information and Communication showed particular interest in deep learning-based virtual human implementation technology. In addition, various ways of cooperation were discussed, including availability of Estonian language, operational solutions, and service advancement. 
Jang Se-young, CEO of DeepBrain AI, said, ”We plan to hold additional detailed working-level discussions with Estonia as soon as possible to ensure that virtual humans can be successfully introduced”, ”This will set a precedent for strengthening communication between state agencies and citizens using virtual humans,” he said. 
Meanwhile, Deep Brain AI is recognized for its global top-level AI human solution capabilities by participating in major global tech events such as CES 2022•2023 and NAB 2022, and repeatedly winning awards. Recently, it has been expanding its global influence by participating in MWC 2024, the world’s largest mobile communications fair held in Barcelona, Spain, and conducting business discussions with officials. (end) 
3. Description page: https://www.aistudios.com/ 
Contact: 
Phone No.: +1 650 279 9646 
SOURCE DeepBrain AI"
2024-03-29 21:11:00,"DeepBrain AI with Estonian Ministry of Economy, Information and Communication discusses introduction of AI human Public Service
USA - English
 * USA - English"," PALO ALTO, Calif., March 29, 2024 /PRNewswire/ -- DeepBrain AI (CEO Se-young Jang), a domestic company specializing in generative artificial intelligence (AI), announced on the 22nd that we met with a visiting delegation from the Estonian Ministry of Economy, Information and Communication to discuss ways to apply AI human in local public services. 
This discussion took place when a visiting delegation from the Estonian Ministry of Economy, Information and Communication, who came to Korea to attend the 3rd Democracy Summit held in Seoul, visited Deep Brain AI headquarters in Gangnam-gu, Seoul on the 20th. This visit was made possible after the Estonian Minister of Economy, Information and Communication’s office directly requested a meeting with Deep Brain AI from the local business office. 
The Estonian Ministry of Economy, Information and Communication is seeking to improve the competitiveness of public services by introducing a virtual assistant using AI technology at its affiliated organization, the Information Systems Agency of Estonia (RIA). In keeping with the trends of the times, the plan is to use AI technology to build a system where the country and citizens can communicate freely. 
As part of this, the Estonian visiting delegation, including Estonian Minister of Economy, Information and Communication Tit Lysalo and Estonian Ambassador to Korea Sten Schwede, held detailed discussions on AI human technologies applicable to RIA, including the introduction of virtual assistants. 
DeepBrain AI introduced the company and demonstrated AI human technology and various services using it, and the visiting delegation from the Estonian Ministry of Economy, Information and Communication showed particular interest in deep learning-based virtual human implementation technology. In addition, various ways of cooperation were discussed, including availability of Estonian language, operational solutions, and service advancement. 
Jang Se-young, CEO of DeepBrain AI, said, ”We plan to hold additional detailed working-level discussions with Estonia as soon as possible to ensure that virtual humans can be successfully introduced”, ”This will set a precedent for strengthening communication between state agencies and citizens using virtual humans,” he said. 
Meanwhile, Deep Brain AI is recognized for its global top-level AI human solution capabilities by participating in major global tech events such as CES 2022•2023 and NAB 2022, and repeatedly winning awards. Recently, it has been expanding its global influence by participating in MWC 2024, the world’s largest mobile communications fair held in Barcelona, Spain, and conducting business discussions with officials. (end) 
3. Description page: https://www.aistudios.com/ 
Contact: 
Phone No.: +1 650 279 9646 
Photo - https://mma.prnewswire.com/media/2375470/Estonian_Ministry_Economy_Information_visits_DeepBrain.jpg"
2024-03-29 21:12:37,"DeepBrain AI with Estonian Ministry of Economy, Information and Communication discusses introduction of AI human Public Service","DeepBrain AI with Estonian Ministry of Economy, Information and Communication discusses introduction of AI human Public Service
Leer todo el artículo
29 de marzo de 2024, 9:51 p. m.
·3  min de lectura
A delegation from Estonia, including Minister Tit Lysalo and Ambassador to Korea Sten Schwede, visited DeepBrain AI headquarters.
Introduce AI human solutions and discuss cooperation plans to implement a virtual assistant at the Estonian Information System Agency
PALO ALTO, Calif., March 29, 2024 /PRNewswire/ -- DeepBrain AI (CEO Se-young Jang), a domestic company specializing in generative artificial intelligence (AI), announced on the 22nd that we met with a visiting delegation from the Estonian Ministry of Economy, Information and Communication to discuss ways to apply AI human in local public services.
This discussion took place when a visiting delegation from the Estonian Ministry of Economy, Information and Communication, who came to Korea to attend the 3rd Democracy Summit held in Seoul, visited Deep Brain AI headquarters in Gangnam-gu, Seoul on the 20th. This visit was made possible after the Estonian Minister of Economy, Information and Communication’s office directly requested a meeting with Deep Brain AI from the local business office.
PUBLICIDAD
The Estonian Ministry of Economy, Information and Communication is seeking to improve the competitiveness of public services by introducing a virtual assistant using AI technology at its affiliated organization, the Information Systems Agency of Estonia (RIA). In keeping with the trends of the times, the plan is to use AI technology to build a system where the country and citizens can communicate freely.
As part of this, the Estonian visiting delegation, including Estonian Minister of Economy, Information and Communication Tit Lysalo and Estonian Ambassador to Korea Sten Schwede, held detailed discussions on AI human technologies applicable to RIA, including the introduction of virtual assistants.
DeepBrain AI introduced the company and demonstrated AI human technology and various services using it, and the visiting delegation from the Estonian Ministry of Economy, Information and Communication showed particular interest in deep learning-based virtual human implementation technology. In addition, various ways of cooperation were discussed, including availability of Estonian language, operational solutions, and service advancement.
Continuar leyendo la historia
Jang Se-young, CEO of DeepBrain AI, said, ”We plan to hold additional detailed working-level discussions with Estonia as soon as possible to ensure that virtual humans can be successfully introduced”, ”This will set a precedent for strengthening communication between state agencies and citizens using virtual humans,” he said.
Meanwhile, Deep Brain AI is recognized for its global top-level AI human solution capabilities by participating in major global tech events such as CES 2022•2023 and NAB 2022, and repeatedly winning awards. Recently, it has been expanding its global influence by participating in MWC 2024, the world’s largest mobile communications fair held in Barcelona, Spain, and conducting business discussions with officials. (end)"
2024-03-29 21:31:10,"$1B of US Treasurys tokenized, Base TVL doubles in a month: Finance Redefinedcointelegraph.com","2 hours ago
$1B of US Treasurys tokenized, Base TVL doubles in a month: Finance Redefined
The real-world asset tokenization trend is heating up, fueled by BlackRock’s first tokenized asset fund, “BUIDL,” which joined 16 other tokenized government securities funds in the last week.
510 Total views
Collect this article as NFT
Join us on social networks
Welcome to Finance Redefined, your weekly dose of essential decentralized finance (DeFi) insights — a newsletter crafted to bring you the most significant developments from the past week.
Over $1 billion of United States Treasurys have been tokenized on Ethereum, Polygon, Solana and other blockchains amid a growing trend of real-world asset tokenization.
A U.S. judge has ruled that Coinbase’s self-custody crypto wallet doesn’t make it a broker, which lawyers say is a “significant setback” for the U.S. Securities and Exchange Commission (SEC) and a boon for DeFi.
Coinbase’s layer-2 platform Base has recently benefitted from the memecoin frenzy, with its total value locked (TVL) on-chain doubling in a month.
Over $1 billion in U.S. Treasurys have now been tokenized on-chain
More than $1 billion worth of United States Treasurys now exist across Ethereum, Polygon, Solana and other blockchains, helped in part by the recent launch of the BlackRock USD Institutional Digital Liquidity Fund .
BlackRock’s product, tickered “BUIDL,” was launched on Ethereum on March 20 and now boasts a market cap of $244.8 million.
According to Etherscan, four transactions to the fund totaling $95 million over the week boosted the fund, making it the second-largest tokenized government securities fund.
Continue reading
Coinbase Wallet’s triumph over SEC allegations is a “giant win” for DeFi
Crypto lawyers are hailing a recent decision by a U.S. judge to dismiss allegations against Coinbase Wallet as a win for self-custody wallets and DeFi apps.
On March 27, U.S. District Judge Katherine Failla denied Coinbase’s bid to dismiss an SEC lawsuit, finding the SEC “sufficiently pleaded” Coinbase was unlicensed and its crypto staking offering was unregistered securities.
The judge also determined that the SEC failed to allege that Coinbase conducted brokerage activity through Coinbase Wallet, which is a self-custody crypto wallet app that gives users full control of their assets.
Continue reading
Solana’s Jupiter DEX kickstarts native DAO with $137 million in initial capital
The Solana-based decentralized exchange (DEX) Jupiter is allocating 10 million USD Coin ( USDC ) and 100 million of its native JUP token, worth a combined $137 million at publication, to kick-start its Jupiter DAO.
In a March 27 announcement, Jupiter said the budget “provides the DAO the capability to fund the ideas with USDC and have the JUP allocation for long-term incentive alignment with J.U.P Contributors.” The exchange added, “To ensure that the DAO will be able to execute on these crucial things over the long term, we will aim to top up the same budget yearly.”
Continue reading
Base TVL doubles in a month as pundits tip memecoins to drive adoption
Ethereum layer-2 network Base’s TVL has doubled in less than a month, reaching $2.13 billion, while commentators say it could become the next epicenter for memecoins.
Base notched $1 billion in TVL on Feb. 27, 226 days after its launch in August 2023. However, the network managed to breach the $2 billion level just 25 days later, on March 23, according to data from L2Beat.
Continue reading
DeFi market overview
Data from Cointelegraph Markets Pro and TradingView shows that DeFi’s top 100 tokens by market capitalization had a bearish week, with most trading in the red on the weekly charts. The total value locked in DeFi protocols rose back above $100 billion.
Thanks for reading our summary of this week’s most impactful DeFi developments. Join us next Friday for more stories, insights and education regarding this dynamically advancing space."
