date,headline,description
2024-03-28 23:11:40,How our feelings about the economy are shaping the election,"Marketplace
0:00 / 0:00
0% played
Let’s close the gap: We still need your help to raise $40,000 by April 1. Donate now
Episode 1128
How our feelings about the economy are shaping the election
And how much does it really matter in the Biden vs. Trump matchup?
<iframe id=”mp_1069239” title=”Marketplace Embed” src=”https://www.marketplace.org/shows/make-me-smart/how-our-feelings-about-the-economy-are-shaping-the-election/popout” frameborder=”0” width=”100%” height=”240px”></iframe>
COPY
And how much does it really matter in the Biden vs. Trump matchup?
get the podcast
Get even smarter with the “Make Me Smart” newsletter. We’ll start your Friday right by explaining the news, rounding up the best stories we read this week and even sharing a cocktail recipe or two.
Email address *
Subscribe
Even though the economy is going strong, many Americans are still pessimistic about it. We’ll get into how feelings and beliefs about the economy are playing into the 2024 presidential election. Plus, guest host Matt Levin joins us to discuss the latest AI news, including a new state law — known as the ELVIS Act — focused on protecting artists’ voices. And he’ll explain why he has the song “Barbie Girl” (Johnny Cash’s version) stuck in his head.
Here’s everything we talked about today:"
2024-03-28 23:14:42,XIDO FINANCE Price Down 10.7% Over Last Week (XIDO),"XIDO FINANCE Price Down 10.7% Over Last Week (XIDO)
Posted by Mickey Rousseau on Mar 28th, 2024
Share on Stocktwits
XIDO FINANCE ( XIDO ) traded 7.4% lower  against the U.S. dollar during the twenty-four hour period ending at 19:00 PM Eastern on March 28th. XIDO FINANCE has a market capitalization of $36.33 million and approximately $155.56 worth of XIDO FINANCE was traded on exchanges in the last 24 hours. One XIDO FINANCE token can currently be purchased for approximately $1.28 or 0.00001810 BTC on major cryptocurrency exchanges. In the last seven days, XIDO FINANCE has traded 10.7% lower  against the U.S. dollar.
Here is how similar cryptocurrencies have performed in the last 24 hours:
Get XIDO FINANCE alerts:
KILT Protocol (KILT) traded down 0% against the dollar and now trades at $0.45 or 0.00000641 BTC.
Aidi Finance (BSC) (AIDI) traded 2.2% lower  against the dollar and now trades at $0.0000 or 0.00000000 BTC.
Zoo Token (ZOOT) traded 2.2% lower  against the dollar and now trades at $0.0652 or 0.00000239 BTC.
CareCoin (CARES) traded down 2.2% against the dollar and now trades at $0.0809 or 0.00000297 BTC.
Kitty Inu (KITTY) traded 1.9% higher  against the dollar and now trades at $95.84 or 0.00338062 BTC.
Hokkaidu Inu (HOKK) traded up 1.2% against the dollar and now trades at $0.0004 or 0.00000001 BTC.
Lego Coin (LEGO) traded flat against the dollar and now trades at $0.0086 or 0.00000013 BTC.
Jeff in Space (JEFF) traded down 2.2% against the dollar and now trades at $2.75 or 0.00010076 BTC.
Lumi Credits (LUMI) traded 0.6% higher  against the dollar and now trades at $0.0093 or 0.00000013 BTC.
AXIA Coin (AXC) traded 0.1% lower  against the dollar and now trades at $13.43 or 0.00048094 BTC.
About XIDO FINANCE
XIDO FINANCE’s genesis date was September 9th, 2020. XIDO FINANCE’s total supply is 100,000,000 tokens and its circulating supply is 28,314,463 tokens. The official website for XIDO FINANCE is xido.finance . XIDO FINANCE’s official Twitter account is @xidofinance and its Facebook page is accessible here . XIDO FINANCE’s official message board is medium.com/@xidofinance .
According to CryptoCompare, “XIDO is decentralized AMM with yield farming incentives, no mints, and a unique token distribution design. Token which adds a governance layer and powers the self-sustaining pools and farms without ever minting a new token.
It is layer protocol for payments specifically built to support the fast-growing DeFi industry using our important technological innovations.”
Buying and Selling XIDO FINANCE
It is usually not currently possible to purchase alternative cryptocurrencies such as XIDO FINANCE directly using US dollars. Investors seeking to trade XIDO FINANCE should first purchase Ethereum or Bitcoin using an exchange that deals in US dollars such as GDAX, Coinbase or Changelly. Investors can then use their newly-acquired Ethereum or Bitcoin to purchase XIDO FINANCE using one of the aforementioned exchanges."
2024-03-28 19:44:51,"US Economy Did Better Than Expected in the Third Quarter, but Current GDP Estimates Crash","U.S. economic growth for the fourth quarter of 2023 has been revised upward, from 3.2 percent to 3.4 percent in the government’s third—and final—update of gross domestic product (GDP) figures, though real-time GDP estimates for the first quarter of 2024 have fallen sharply, undercutting... read full story "
2024-03-28 23:18:42,"How the Baltimore Bridge Disaster Could Impact Supply Chains, Local Economy","How the Baltimore Bridge Disaster Could Impact Supply Chains, Local Economy
The Francis Scott Key Bridge disaster at the Port of Baltimore is expected to produce a ripple effect for both the local and national economy—from supply chain disruptions to potential inflationary pressures. As officials and experts... read full story
Ask about this article"
2024-03-28 23:14:43,XIDO FINANCE Price Down 10.7% Over Last Week (XIDO),"XIDO FINANCE (XIDO) traded 7.4% lower against the U.S. dollar during the
twenty-four hour period ending at 19:00 PM Eastern on March 28th. XIDO FINANCE
has a market capitalization of $36.33 million and approximately $155.56 worth of
XIDO FINANCE was traded on exchanges in the last 24 hours. One XIDO FINANCE
token can currently be […]"
2024-03-28 23:34:42,Bao Finance (BAO) Price Up 4.6% This Week,"Bao Finance (BAO) Price Up 4.6% This Week
Posted by Gary Stephens on Mar 28th, 2024
Share on Stocktwits
Bao Finance ( BAO ) traded down 0% against the dollar during the 1-day period ending at 19:00 PM Eastern on March 28th. Over the last seven days, Bao Finance has traded 4.6% higher  against the dollar. Bao Finance has a total market capitalization of $710,670.55 and approximately $0.01 worth of Bao Finance was traded on exchanges in the last day. One Bao Finance token can currently be purchased for approximately $0.0000 or 0.00000000 BTC on popular cryptocurrency exchanges.
Here’s how similar cryptocurrencies have performed over the last day:
Get Bao Finance alerts:
KILT Protocol (KILT) traded 0% lower  against the dollar and now trades at $0.45 or 0.00000641 BTC.
Aidi Finance (BSC) (AIDI) traded 2.2% lower  against the dollar and now trades at $0.0000 or 0.00000000 BTC.
Zoo Token (ZOOT) traded down 2.2% against the dollar and now trades at $0.0652 or 0.00000239 BTC.
CareCoin (CARES) traded down 2.2% against the dollar and now trades at $0.0809 or 0.00000297 BTC.
Kitty Inu (KITTY) traded 1.9% higher  against the dollar and now trades at $95.84 or 0.00338062 BTC.
Hokkaidu Inu (HOKK) traded up 1.2% against the dollar and now trades at $0.0004 or 0.00000001 BTC.
Lego Coin (LEGO) traded flat against the dollar and now trades at $0.0086 or 0.00000013 BTC.
Jeff in Space (JEFF) traded down 2.2% against the dollar and now trades at $2.75 or 0.00010076 BTC.
Lumi Credits (LUMI) traded 0.6% higher  against the dollar and now trades at $0.0093 or 0.00000013 BTC.
AXIA Coin (AXC) traded down 0.1% against the dollar and now trades at $13.43 or 0.00048094 BTC.
Bao Finance Profile
Bao Finance’s genesis date was December 2nd, 2020. Bao Finance’s total supply is 560,270,974,250 tokens and its circulating supply is 34,066,471,176 tokens. Bao Finance’s official message board is thebaoman.medium.com . Bao Finance’s official website is www.baofinance.io . Bao Finance’s official Twitter account is @baocommunity and its Facebook page is accessible here .
According to CryptoCompare, “Bao (包) stands for a treasure or package. Something wonderful that is wrapped up in another layer. Bao buns, or in Chinese Baozi (包子) are delicious wrapped dumplings.
These bao buns are the tradition of taking something good that exists and wrapping it up into being a new treasure.
Bao Finance aims to do this by being a new protocol that adds features to existing DeFi systems.
The BAO token acts as a governance token for the fully community-run project. It is also backed by the insurance fund where all Bao fees go.”
Buying and Selling Bao Finance
It is usually not possible to purchase alternative cryptocurrencies such as Bao Finance directly using U.S. dollars. Investors seeking to trade Bao Finance should first purchase Bitcoin or Ethereum using an exchange that deals in U.S. dollars such as Changelly, Coinbase or GDAX. Investors can then use their newly-acquired Bitcoin or Ethereum to purchase Bao Finance using one of the exchanges listed above."
2024-03-29 00:12:01,“Mizuho Positive Impact Finance” Loan Agreement Signed (HITZ - Hitachi Zosen Corporation),") March 28, 2024 ”Mizuho Positive Impact Finance” Loan Agreement Signed Hitachi Zosen Corporation signed the loan agreement with Mizuho Bank, Ltd (Tokyo, President & CEO : Masahiko Kato; hereinafter, ”Mizuho Bank”) for ’Mizuho Positive Impact Finance’, which has been executed today.... read full story "
2024-03-28 23:00:07,"UK economy went into recession last year, data confirms","Britain’s economy entered a shallow recession last year, official figures confirmed on Thursday, leaving Prime Minister... read full story "
2024-03-28 16:38:28,UAE to introduce long-term business licences to boost economy,"In an effort to boost government revenues, vitalize businesses, and promote sustainable growth and prosperity in the country, the UAE is contemplating the introduction of long-term business licenses, including 10-year golden and five-year silver licenses. The said proposal was discussed during the inaugural... read full story "
2024-03-29 00:40:35,"Japan won’t rule out any steps to respond to disorderly FX moves, finance minister says","(marketscreener.com) Japanese Finance Minister Shunichi Suzuki said on Friday
that the government would not rule out any steps to respond to disorderly forex
moves. He made the comment after the yen's weakened to a 34-year low against the
dollar at 151.975 yen earlier this week. 
https://www.marketscreener.com/news/latest/Japan-won-t-rule-out-any-steps-to-respond-to-disorderly-FX-moves-finance-minister-says--46316097/?utm_medium=RSS&utm_content=20240328"
2024-03-29 01:12:48,Runway Growth Finance Corp. 8.00% Notes due 2027 (NASDAQ:RWAYZ) Short Interest Up 400.0% in March, Receive News & Ratings for Runway Growth Finance Corp. 8.00% Notes due 2027 Daily - Enter your email address below to receive a concise daily summary of the latest news and analysts’ ratings for Runway Growth Finance Corp. 8.00% Notes due 2027 and related companies with MarketBeat.com’s FREE daily email newsletter.
2024-03-29 01:12:43,Runway Growth Finance Corp. 8.00% Notes due 2027 (NASDAQ:RWAYZ) Short Interest Up 400.0% in March, Receive News & Ratings for Runway Growth Finance Corp. 8.00% Notes due 2027 Daily - Enter your email address below to receive a concise daily summary of the latest news and analysts’ ratings for Runway Growth Finance Corp. 8.00% Notes due 2027 and related companies with MarketBeat.com’s FREE daily email newsletter.
2024-03-29 01:12:44,Roma Green Finance Limited (NASDAQ:ROMA) Sees Significant Growth in Short Interest,"Roma Green Finance Limited (NASDAQ:ROMA) Sees Significant Growth in Short Interest
Posted by Anthony Bellafiore on Mar 29th, 2024
Share on Stocktwits
Roma Green Finance Limited ( NASDAQ:ROMA – Get Free Report ) saw a large growth in short interest in the month of March. As of March 15th, there was short interest totalling 178,600 shares,  a growth of 90.4% from the February 29th total of 93,800 shares. Based on an average daily trading volume, of 3,230,000 shares, the short-interest ratio is presently 0.1 days.
Roma Green Finance Stock Performance
Shares of NASDAQ ROMA traded up $0.03 during trading hours on Thursday, reaching $1.03. The stock had a trading volume of 121,835 shares, compared to its average volume of 3,095,557. The company has a fifty day moving average price of $1.11. Roma Green Finance has a 52-week low of $0.68 and a 52-week high of $11.80.
Get Roma Green Finance alerts:
About Roma Green Finance"
2024-03-28 21:12:43,Roma Green Finance Limited (NASDAQ:ROMA) Sees Significant Growth in Short Interest,"Roma Green Finance Limited (NASDAQ:ROMA) Sees Significant Growth in Short Interest
Posted by Erica Schwartz on Mar 28th, 2024
Share on Stocktwits
Roma Green Finance Limited ( NASDAQ:ROMA – Get Free Report ) saw a large growth in short interest in the month of March. As of March 15th, there was short interest totalling 178,600 shares,  a growth of 90.4% from the February 29th total of 93,800 shares. Based on an average daily trading volume, of 3,230,000 shares, the short-interest ratio is presently 0.1 days.
Roma Green Finance Stock Performance
Shares of NASDAQ ROMA traded up $0.03 during trading hours on Thursday, reaching $1.03. The stock had a trading volume of 121,835 shares, compared to its average volume of 3,095,557. The company has a fifty day moving average price of $1.11. Roma Green Finance has a 52-week low of $0.68 and a 52-week high of $11.80.
Get Roma Green Finance alerts:
About Roma Green Finance"
2024-03-29 00:24:16,South Africa: Conservation Key to Building a Thriving Biodiversity Economy,"The importance of conserving natural areas for a robust biodiversity economy was a key takeaway from discussions on the National Biodiversity Economy Strategy. Minister of Forestry, Fisheries and the Environment, Barbara Creecy, expressed her gratitude to participants for their valuable contributions in developing the strategy.... read full story "
2024-03-29 00:56:21,Publication of Transition Strategies toward Nature Positive Economy (Minister of Environment of the State of Japan),") March 28, 2024 Nature & Parks Publication of Transition Strategies toward Nature Positive Economy 日本語へ 1.The Ministry of the Environment, the Ministry of Agriculture, Forestry and Fisheries, the Ministry of Economy, Trade and Industry, and the Ministry of Land, Infrastructure, Transport and Tourism... read full story "
2024-03-29 01:52:47,Alpha Finance Lab (ALPHA) Reaches Market Cap of $163.41 Million,"Alpha Finance Lab (ALPHA) traded 0.4% higher against the U.S. dollar during the
24 hour period ending at 21:00 PM E.T. on March 28th. During the last week,
Alpha Finance Lab has traded 0% higher against the U.S. dollar. Alpha Finance
Lab has a total market cap of $163.41 million and $4.31 million worth of […]"
2024-03-29 01:26:21,UK economy falls by 0.3% in Q4 2023,"LONDON -- The gross domestic product (GDP) of the United Kingdom (UK) fell by an unrevised 0.3 percent in the last quarter of 2023, data from the Office for National Statistics (ONS) showed on Thursday. It’s the second consecutive quarter that the economy witnessed negative growth, which indicated that the UK fell into... read full story "
2024-03-29 01:19:20,"Russia, BRICS NDB President Discuss Global Economy, Bank’s Activities in Russia","�Russia’s Deputy Prime Minister Alexey Overchuk met with Dilma Rousseff, President of the BRICS New Development Bank (NDB), to discuss the current global economic climate and the bank’s work in Russia. The meeting covered ongoing economic trends, NDB’s activities within Russia, and the country’s priorities for... read full story "
2024-03-27 10:38:21,Zimbabwe inflation rate hits seven-month high as finance minister pledges to act,"Annual inflation quickened to 55.3% this month from 47.6% in February, the Zimbabwe National Statistics Agency said Wednesday. ...... read full story "
2024-03-28 22:10:42,Ribbon Finance Trading Up 22.9% Over Last 7 Days (RBN),"Ribbon Finance Trading Up 22.9% Over Last 7 Days (RBN)
Posted by James Nelson on Mar 28th, 2024
Share on Stocktwits
Ribbon Finance ( RBN ) traded up 6.8% against the U.S. dollar during the 24-hour period ending at 22:00 PM ET on March 28th. One Ribbon Finance token can now be bought for $1.69 or 0.00002391 BTC on popular exchanges. Over the last week, Ribbon Finance has traded up 22.9% against the U.S. dollar. Ribbon Finance has a total market cap of $570.03 million and $23.36 million worth of Ribbon Finance was traded on exchanges in the last 24 hours.
Here is how related cryptocurrencies have performed over the last 24 hours:
Get Ribbon Finance alerts:
KILT Protocol (KILT) traded 1.9% lower  against the dollar and now trades at $0.45 or 0.00000638 BTC.
Aidi Finance (BSC) (AIDI) traded 2.2% lower  against the dollar and now trades at $0.0000 or 0.00000000 BTC.
Zoo Token (ZOOT) traded 2.2% lower  against the dollar and now trades at $0.0652 or 0.00000239 BTC.
CareCoin (CARES) traded down 2.2% against the dollar and now trades at $0.0809 or 0.00000297 BTC.
Kitty Inu (KITTY) traded 1.9% higher  against the dollar and now trades at $95.84 or 0.00338062 BTC.
Hokkaidu Inu (HOKK) traded up 1.2% against the dollar and now trades at $0.0004 or 0.00000001 BTC.
Lego Coin (LEGO) traded flat against the dollar and now trades at $0.0086 or 0.00000013 BTC.
Jeff in Space (JEFF) traded down 2.2% against the dollar and now trades at $2.75 or 0.00010076 BTC.
Lumi Credits (LUMI) traded 0.8% higher  against the dollar and now trades at $0.0093 or 0.00000013 BTC.
AXIA Coin (AXC) traded 0.1% lower  against the dollar and now trades at $13.43 or 0.00048094 BTC.
Ribbon Finance Profile
Ribbon Finance was first traded on May 24th, 2021. Ribbon Finance’s total supply is 1,000,000,000 tokens and its circulating supply is 336,479,659 tokens. The official website for Ribbon Finance is www.ribbon.finance . Ribbon Finance’s official Twitter account is @ribbonfinance and its Facebook page is accessible here . The official message board for Ribbon Finance is ribbonfinance.medium.com .
According to CryptoCompare, “Ribbon Finance is a DeFi protocol that offers access to structured crypto products such as options, futures, and fixed income to improve a portfolio’s risk-return profile. RBN is the governance token of Ribbon Finance, used to steward the development of the protocol, align incentives between stakeholders, and unite all Ribbon products under a single umbrella.”
Ribbon Finance Token Trading
It is usually not possible to buy alternative cryptocurrencies such as Ribbon Finance directly using US dollars. Investors seeking to acquire Ribbon Finance should first buy Ethereum or Bitcoin using an exchange that deals in US dollars such as Changelly, Coinbase or GDAX. Investors can then use their newly-acquired Ethereum or Bitcoin to buy Ribbon Finance using one of the aforementioned exchanges."
2024-03-28 22:10:42,VVS Finance Trading Up 10.1% Over Last Week (VVS),"VVS Finance Trading Up 10.1% Over Last Week (VVS)
Posted by James Nelson on Mar 28th, 2024
Share on Stocktwits
VVS Finance ( VVS ) traded up 2.7% against the US dollar during the 24 hour period ending at 22:00 PM E.T. on March 28th. Over the last seven days, VVS Finance has traded up 10.1% against the US dollar. VVS Finance has a market cap of $232.39 million and approximately $1.37 million worth of VVS Finance was traded on exchanges in the last day. One VVS Finance token can now be purchased for about $0.0000 or 0.00000000 BTC on popular exchanges.
Here is how other cryptocurrencies have performed over the last day:
Get VVS Finance alerts:
KILT Protocol (KILT) traded 1.9% lower  against the dollar and now trades at $0.45 or 0.00000638 BTC.
Aidi Finance (BSC) (AIDI) traded down 2.2% against the dollar and now trades at $0.0000 or 0.00000000 BTC.
Zoo Token (ZOOT) traded down 2.2% against the dollar and now trades at $0.0652 or 0.00000239 BTC.
CareCoin (CARES) traded down 2.2% against the dollar and now trades at $0.0809 or 0.00000297 BTC.
Kitty Inu (KITTY) traded 1.9% higher  against the dollar and now trades at $95.84 or 0.00338062 BTC.
Hokkaidu Inu (HOKK) traded up 1.2% against the dollar and now trades at $0.0004 or 0.00000001 BTC.
Lego Coin (LEGO) traded flat against the dollar and now trades at $0.0086 or 0.00000013 BTC.
Jeff in Space (JEFF) traded down 2.2% against the dollar and now trades at $2.75 or 0.00010076 BTC.
Lumi Credits (LUMI) traded up 0.8% against the dollar and now trades at $0.0093 or 0.00000013 BTC.
AXIA Coin (AXC) traded 0.1% lower  against the dollar and now trades at $13.43 or 0.00048094 BTC.
VVS Finance Profile
VVS Finance’s launch date was November 9th, 2021. VVS Finance’s total supply is 86,323,764,808,650 tokens and its circulating supply is 44,838,604,635,697 tokens. VVS Finance’s official Twitter account is @vvs_finance and its Facebook page is accessible here . VVS Finance’s official website is vvs.finance .
According to CryptoCompare, “Built on the Cronos blockchain, VVS Finance leverages proven and audited protocols. It stands out with a comprehensive and rewarding incentive program, powered by its governance token with the ticker of VVS.”
VVS Finance Token Trading
It is usually not presently possible to purchase alternative cryptocurrencies such as VVS Finance directly using US dollars. Investors seeking to acquire VVS Finance should first purchase Bitcoin or Ethereum using an exchange that deals in US dollars such as Changelly, Gemini or Coinbase . Investors can then use their newly-acquired Bitcoin or Ethereum to purchase VVS Finance using one of the exchanges listed above."
2024-03-29 02:10:45,Ribbon Finance Self Reported Market Cap Reaches $570.03 Million (RBN),"Ribbon Finance Self Reported Market Cap Reaches $570.03 Million (RBN)
Posted by Nicole Kennedy on Mar 29th, 2024
Share on Stocktwits
Ribbon Finance ( RBN ) traded up 6.8% against the U.S. dollar during the 24 hour period ending at 22:00 PM ET on March 28th. During the last seven days, Ribbon Finance has traded up 22.9% against the U.S. dollar. One Ribbon Finance token can currently be bought for approximately $1.69 or 0.00002391 BTC on major exchanges. Ribbon Finance has a market capitalization of $570.03 million and approximately $23.36 million worth of Ribbon Finance was traded on exchanges in the last day.
Here’s how similar cryptocurrencies have performed during the last day:
Get Ribbon Finance alerts:
KILT Protocol (KILT) traded down 1.9% against the dollar and now trades at $0.45 or 0.00000638 BTC.
Aidi Finance (BSC) (AIDI) traded down 2.2% against the dollar and now trades at $0.0000 or 0.00000000 BTC.
Zoo Token (ZOOT) traded down 2.2% against the dollar and now trades at $0.0652 or 0.00000239 BTC.
CareCoin (CARES) traded down 2.2% against the dollar and now trades at $0.0809 or 0.00000297 BTC.
Kitty Inu (KITTY) traded up 1.9% against the dollar and now trades at $95.84 or 0.00338062 BTC.
Hokkaidu Inu (HOKK) traded 1.2% higher  against the dollar and now trades at $0.0004 or 0.00000001 BTC.
Lego Coin (LEGO) traded flat against the dollar and now trades at $0.0086 or 0.00000013 BTC.
Jeff in Space (JEFF) traded down 2.2% against the dollar and now trades at $2.75 or 0.00010076 BTC.
Lumi Credits (LUMI) traded 0.8% higher  against the dollar and now trades at $0.0093 or 0.00000013 BTC.
AXIA Coin (AXC) traded down 0.1% against the dollar and now trades at $13.43 or 0.00048094 BTC.
Ribbon Finance Profile
Ribbon Finance was first traded on May 24th, 2021. Ribbon Finance’s total supply is 1,000,000,000 tokens and its circulating supply is 336,479,659 tokens. The official message board for Ribbon Finance is ribbonfinance.medium.com . Ribbon Finance’s official website is www.ribbon.finance . Ribbon Finance’s official Twitter account is @ribbonfinance and its Facebook page is accessible here .
According to CryptoCompare, “Ribbon Finance is a DeFi protocol that offers access to structured crypto products such as options, futures, and fixed income to improve a portfolio’s risk-return profile. RBN is the governance token of Ribbon Finance, used to steward the development of the protocol, align incentives between stakeholders, and unite all Ribbon products under a single umbrella.”
Buying and Selling Ribbon Finance
It is usually not presently possible to buy alternative cryptocurrencies such as Ribbon Finance directly using U.S. dollars. Investors seeking to trade Ribbon Finance should first buy Bitcoin or Ethereum using an exchange that deals in U.S. dollars such as Changelly, GDAX or Coinbase . Investors can then use their newly-acquired Bitcoin or Ethereum to buy Ribbon Finance using one of the exchanges listed above."
2024-03-29 02:45:07,"Prisma Finance Suffers Exploit, Drained $11 Million","Prisma Finance Suffers Exploit, Drained $11 Million
Posted 2024-03-28, CoinGape Headlines photo
Decentralized lending protocol Prisma Finance has suffered a major exploit with losses above $11 million sparking concerns for the wider crypto community.  Blockchain security firm flagged suspicious on-chain activity on March 28 with initial losses of $8.1 million. Following investigations, the total assets drained hit... read full story
”Following the exploit affecting several users’ vaults, Prisma Protocol has been paused by the emergency multisig and the remaining funds are safe. mkUSD and ULTRA, as stablecoins, are overcollateralized and are not at risk.”
Ask about this article"
