date,headline,description
2024-02-29 23:05:42,Brazil’s finance minister proposes global tax on the super-rich at G20 meeting in Sao Paulo," U.S. Secretary of the Treasury Janet L. Yellen, left, shakes hands with Saudi Arabia’s Finance Minister Mohammed al-Jadaan before their bilateral meeting at the G20 Finance Ministers and Central Bank Governors meeting in Sao Paulo, Brazil, Thursday, Feb. 29, 2024. (AP Photo/Andre Penner) 
RIO DE JANEIRO (AP) — Brazil’s finance minister told his peers Thursday at a G20 meeting in Sao Paulo that countries should implement a global tax on the super-rich in an effort to tackle rampant tax evasion. 
Fernando Haddad said tax evasion can be resolved through international cooperation so that “these few individuals make their contribution to our societies and to the planet’s sustainable development.” 
He added that Brazil is pushing for a declaration on international taxation by G20 members that he hopes would be ready in July. But in a press conference at the end of the meeting, he recognized the path would be far from smooth. 
“There will be a lot of debate about this, which is absolutely natural, especially because not every country feels the same way about this problem that was brought to the G20 by Brazil,” he said. 
Brazil currently has the presidency of the 20 leading rich and developing nations and President Luiz Inácio Lula da Silva has put issues that concern the developing world – such as the reduction of inequalities and the reform of multilateral institutions — at the heart of its agenda. 
“Brazil has a role to play, a legitimacy to use on the issues that need to be addressed and that are not always represented in the G20,” Haddad said, pointing to environmental, social and fiscal issues. 
According to a 2023 study by advocacy group Tax Justice Network, countries around the world could lose up to $4.8 trillion in tax revenue over the next decade due to tax havens. And a report earlier this year by the EU Tax Observatory cited by Haddad, found that billionaires worldwide have effective tax rates equivalent of between 0% and 0.5% of their wealth. 
In recent years, scandals such as the Panama Papers Leak and the Paradise Papers have shone a light on the pervasiveness of tax evasion and avoidance in business practices. 
Meanwhile, the gap between the super-rich and the bulk of the global population has been supercharged since the coronavirus pandemic, according to anti-poverty organization Oxfam International. 
“There are fewer taxes on assets today than two or three decades ago. The global movement has tended towards reducing taxation on companies and wealth,” said André Vereta-Nahoum, a sociology professor at the University of Sao Paulo. 
But with inequalities soaring, more are calling for higher taxes on the wealthy – including U.S. President Joe Biden, who has pushed for a billionaire minimum income tax although the likelihood of Congress passing that proposal is minimal. 
In a sign of growing global consensus on the matter, the United Nations General Assembly adopted a resolution late last year backing stronger international tax cooperation to “make it fully inclusive and more effective.” 
“The difficulty is no longer putting the issue on the table, the data is there. The difficulty is arriving at a common document,” said Carla Beni, an economist from the Getulio Vargas Foundation, a university and think tank. 
____ 
Follow AP’s coverage of Latin America and the Caribbean at https://apnews.com/hub/latin-america"
2024-03-01 03:45:00,"China's manufacturing sector remained in contraction for a fifth consecutive month in February, underscoring the difficulties facing the country's leadership as it seeks to support a faltering economy.","China’s manufacturing sector remained in contraction for a fifth consecutive month in February, underscoring the difficulties facing the country’s leadership as it seeks to support a faltering economy."
2024-03-01 04:00:47,IMF executive director: India is the world's 'fastest-growing economy',"Krishnamurthy Subramanian, executive director at the International Monetary Fund and former chief economic advisor of India, discusses the country's gross domestic product data."
2024-03-01 03:23:50,China’s economy still not revving in all cylinders," China’s manufacturing sector continued its contraction for the fifth consecutive month, signalling ongoing sluggishness in the world’s second-largest economy as Beijing prepares to unveil its annual growth target at the upcoming meeting of its always agreeable with President Xi parliament. 
The official manufacturing Purchasing Managers’ Index (PMI) for February stood at 49.1, in line with the median forecast of analysts surveyed by Reuters. This figure was slightly lower than January’s reading of 49.2; hence, the sector is still wallowing in contraction territory. 
On the other hand, the non-manufacturing PMI, which encompasses services and construction, recorded a reading of 51.4 and surpassed analyst expectations and marked an improvement from January’s figure of 50.7 and, in no small part due to the policymaker’s efforts to stabilize the property sectors. 
Still, The mixed performance across different sectors underscores the challenges policymakers face to get the demand side of the economy revving on all cylinders. While services and construction show signs of rebounding, the manufacturing sector continues to grapple with headwinds and subdued activity levels. 
The Yen remains in focus, with FX traders getting on and off the Bank Of Japan policy game of chance wheel. Outside of month-end Yen rebalancing swings, Governor Kazuo Ueda’s overnight remarks added another twist to market rate hike expectations. 
Despite new momentum anticipating potential rate hikes, Ueda emphasized that the BoJ’s price target remains elusive, indicating that the central bank is not ready to consider its first rate hike since 2007. 
In his statement following a meeting with a Group of 20 finance chiefs in Sao Paulo, Brazil, Ueda highlighted the importance of confirming whether the anticipated virtuous cycle between wages and prices has commenced. 
Hence, the Yen has returned over 100pb to the dollar in the past 12 hours. We did warn that volatility would pick up."
2024-03-01 04:35:37,"What’s Wrong With China’s Economy, in Eight Charts",Challenges are multiplying after the country’s years of rapid growth.5 min read
2024-03-01 05:07:33,Le film ”Sound of Freedom” a été financé par le franc-maçon milliardaire Carlos Slim, Actor Jim Caviezel and Tim Ballard of Operation Underground Railroad - 3 Questions with Bob Evans
2024-03-01 05:03:00,"What's Wrong With China's Economy, in Eight Charts",Challenges are multiplying after the country’s years of rapid growth.
2024-03-01 05:39:00,"WISCO, China Unicom und ZTE bei den GLOMO Awards 2024 als „Best Mobile Innovation for Connected Economy” ausgezeichnet
USA - Deutsch
 * USA - English
 * USA - English
 * BRAZIL - Portuguese
 * USA - Nederlands
 * Middle East - Arabic"," BARCELONA, Spanien, 1. März 2024 /PRNewswire/ -- ZTE Corporation (0763.HK / 000063.SZ), ein weltweit führender Anbieter von Informations- und Kommunikationstechnologielösungen, gab in Partnerschaft mit Wuhan Iron and Steel Co.,Ltd. (WISCO) und China Unicom bekannt, dass ihr gemeinsames Projekt „5G Fully Connected Smart Steel Factory” (Vollständig 5G-vernetzte intelligente Stahlfabrik) bei den Global Mobile (GLOMO) Awards während des MWC Barcelona 2024 die Auszeichnung „Best Mobile Innovation for Connected Economy” (Beste mobile Innovation für die vernetzte Wirtschaft) erhielt. Die Auszeichnung ist eine Anerkennung für ihre beeindruckenden Bemühungen, die Arbeitsweise der Menschen in Fabriken zu verändern und den Arbeitsplatz zu digitalisieren. 
Seit 2020 hat die Zusammenarbeit zwischen WISCO und seinen Partnern zur Gründung des Projekts „5G Fully Connected Smart Steel Factory” geführt. Dieses Projekt hat sich nun zum größten 5G-Privatnetzwerk der globalen Stahlindustrie entwickelt und erreicht eine beeindruckende 99-prozentige 5G-Abdeckung innerhalb des Fabrikgeländes. Bei dem Projekt wird diese robuste private 5G-Netzwerkinfrastruktur genutzt und es wurden 25 Stahlanwendungen in sechs wichtigen Szenarien bereitgestellt. Diese Anwendungen umfassen intelligente Logistik, Produktionssteuerung, digitales Gerätemanagement, Energie- und Umweltkontrolle, Qualitätskontrolle und Sicherheitsmanagement. Um den Betrieb zu optimieren, hat das Werk ein Kontrollzentrum auf Unternehmensebene sowie dedizierte Betriebszentren für die Eisenherstellung, die Stahlherstellung, das CSP und das Warmwalzen eingerichtet. Dieser integrierte Ansatz hat den Weg für einen nahtlosen Stahlherstellungsprozess geebnet, bei dem alles aus einer Hand kommt. 
Das private 5G-Netzwerk wurde im wichtigsten Produktionsbereich von WISCO eingesetzt. Mehr als 100 Laufkrane haben den unbemannten Umbau abgeschlossen. Seit der Einführung des intelligenten Transports von geschmolzenem Eisen hat sich die Transporteffizienz kontinuierlich verbessert. Bemerkenswert ist, dass der Temperaturabfall von geschmolzenem Eisen während des Transports weniger als 100 Grad beträgt, was einen neuen Rekord für extreme Effizienz darstellt und zu einer jährlichen Reduzierung von über 750.000 Tonnen Kohlenstoffemissionen führt. 
Li Xiaotong, Vice President bei ZTE, sagte: „Wir fühlen uns geehrt, diese Auszeichnung im Namen des gemeinsamen Projektteams zu erhalten. Dieses Projekt ist eine unserer bedeutenden praktischen Errungenschaften bei der digitalen Modernisierung der Stahlmetallurgie und der Prozessindustrie. Die Anerkennung dieses Projekts durch die GSMA wird auch zu einer treibenden Kraft für unseren weiteren Fortschritt werden. Die Komplettlösung für private 5G-Netzwerke von ZTE, die im Industriepark von WISCO inmitten von hohen Temperaturen und elektromagnetischen Störungen eingesetzt wird, verfügt über dieselbe Netzwerkkapazität wie das industrielle Ethernet mit den zusätzlichen Vorteilen einer flexibleren Bereitstellung und eines bequemeren Zugangs. In Zukunft wird ZTE mit mehr Industriepartnern zusammenarbeiten, um die digitale Transformation und intelligente Modernisierung der Stahlindustrie voranzutreiben.” 
Die jährlichen GLOMO Awards sind die renommierteste Auszeichnung der Branche. Mit einer Jury, die in diesem Jahr über 240 globale Analysten, Medienfachleute und Branchenexperten umfasst, werden bei den GLOMO Awards 2024 Einzelpersonen und Unternehmen geehrt, die Innovationen vorantreiben und Spitzenleistungen in der schnell wachsenden mobilen Branche präsentieren. 
Für weitere Informationen besuchen Sie bitte den ZTE-Stand (3F30, Halle 3, Fira Gran Via) auf dem MWC Barcelona 2024 oder informieren Sie sich hier: hhttps://www.zte.com.cn/global/about/exhibition/mwc24.html  
ZTE ist ein Anbieter von modernen Telekommunikationssystemen, mobilen Endgeräten und Netzwerklösungen für Mobilfunkbetreiber, Unternehmen, öffentliche Einrichtungen und private Anwender. Das Unternehmen entwickelt für seine Kunden integrierte, durchgängige Innovationen für hervorragende und hochwertige Produkte im Konvergenzbereich der Telekommunikations- und Informationstechnologie. ZTE ist an den Börsen Hongkong und Shenzhen notiert (H-Aktienkürzel 0763.HK / A-Aktienkürzel 000063.SZ) und liefert anwenderoptimierte Produkte und Services an über 500 Netzbetreiber in mehr als 160 Ländern. ZTE investiert mindestens zehn Prozent seines Jahresumsatzes in Forschung und Entwicklung und spielt eine wichtige Rolle in einer Reihe internationaler Gremien zur Entwicklung internationaler Standards. Als Unternehmen, das der Corporate SocialResponsibility (CSR) große Bedeutung beimisst, ist ZTE Mitglied des UN-Netzwerkes Global Compact. Weitere Informationen finden Sie unter www.zte.com.cn 
YouTube www.youtube.com/@ZTECorporation 
E-Mail: [email protected]"
2024-03-01 06:00:00,How the myth of the ‘state pension pot’ has warped Britain’s finances," State Pension Pot Jeremy Hunt 
Pick up your annual tax summary from HMRC and you will see 10pc of what the Government takes from you goes towards the state pension. 
It gives the impression that you, the taxpayer, are storing up a substantial nest egg to protect you in retirement. 
The phrase “National Insurance Contributions” (NICs) suggests that this tax goes into a fund that will be there to pay our state pension on retirement, or help with benefits should you need them. 
Unfortunately, anyone who gets that impression would be terribly mistaken. The money is not saved – taxes and NICs that are paid to HMRC today go straight out the door to pay pensioners who are currently claiming their retirement benefits. 
Each generation’s pensioners rely on the taxes of younger workers, an intergenerational compact that relies on continued participation. 
In the second of our three-part series on the future of the state pension, we look at how the myth of the “state pension pot” has evolved and what it means for the country. 
National Insurance is set to bring in just over £176bn for the Government in the coming financial year. Spending on pensioners – covering the state pension, pension credit, housing benefits for retirees and other support – will total £152bn. 
That leaves £24bn that theoretically could be set aside for future pension payments. Yet instead it goes towards spending on health, social care and any other parts of the state that needs the cash. 
The absence of any real ring-fenced pension pot is a problem. Britain’s population is ageing, meaning there are a growing number of pensioners. 
The state pension is rising at the same time thanks to the ratcheting effect of the triple lock. 
Under the current system, a growing number of retirees will be claiming increasingly generous payments that rely on the taxes of a relatively smaller pool of workers. 
In the short-run, taxpayers will be squeezed to cover the cost. National Insurance payments are set to rise by £25bn by 2028-29, the Office for Budget Responsibility (OBR) estimates, as frozen thresholds at a time of high inflation pull more workers into paying the tax. 
Pensioner payments are set to grow by around £20bn over the same period, meaning the ledger will balance. 
However, how long this arrangement will hold politically is an open question. 
Increases in National Insurance are fuelling a rise in the tax burden to levels not seen since the aftermath of the Second World War. The issue is growing more politically toxic by the day. 
The strategy of asking today’s workers to pay for current retirees’ pensions risks reaching breaking point. 
The “pay as you go” method of financing the state pension has been enshrined in the system ever since it came into being in its modern form in 1948. 
William Beveridge, the Liberal politician who helped engineer the welfare state, wanted a different model. He wanted workers to pay in first before qualifying for the pension. 
However, the Government was not keen to charge workers a tax for years before introducing a pension given the impoverished, war-weary state of the nation. Instead, it introduced an immediate financial safety net paid for through current taxes. 
The details of the system have changed since then. Past arrangements included earnings-related additional pensions, which allowed people to pay extra for a bigger pension, or a second state pension for low earners. 
Today, the new state pension, which was introduced in 2016, is a simple flat rate. Those who qualify get £203.85 per week, a figure which rises each year in line with the triple lock – the highest of inflation, average wages or 2.5pc. 
Workers need to rack up 35 years of National Insurance contributions to qualify for a full pension. 
Contributions are deducted automatically from people’s pay cheques once they are earning more than £1,048 a month. 
However, there are also other ways to build up eligibility – signing up for unemployment benefits while hunting for a job also counts to the 35 year requirement, for instance. Similarly, parents who receive child benefits also gain credit. The policy means that those who take time off work to raise a family do not blow a hole in their retirement provision. 
The generosity of the current system means Britain is “rapidly moving to a state pension system in which most people who live in the UK all their adult life get a full state pension”, according to the Institute for Fiscal Studies (IFS). 
Even people who take government-backed training courses can gain eligibility, points out Jonathan Cribb at the IFS. It means the liability of the state pension swells even as the income from National Insurance does not. 
Then there are top ups available to help those without a full new state pension with living costs, including pension credit and housing benefit. On top of that come old age handouts such as winter fuel payments and free bus passes. 
For those in retirement today, all of this is good news. 
“It provides a good base layer of income, particularly if you are a couple, particularly if you own your own home,” says Cribb. “With two full state pensions, you are definitely not going to be in income poverty with that.” 
Yet in terms of funding, the system is not particularly coherent. The link to National Insurance, for instance, is not consistent. 
Pensions or future allowances did not rise when Rishi Sunak as Chancellor increased the rate of National Insurance contributions in April 2022. Nor did they fall when Kwasi Kwarteng reversed the increase or when Jeremy Hunt cut the tax further at the start of this year. 
Meanwhile, someone who has achieved 35 years of NI contributions is still charged National Insurance even though it is of no further use to their ultimate pension allowance. 
The inconsistencies highlight the increasingly shaky position of the state pension. 
Politicians have long acknowledged a brewing problem but past attempts to solve it have proved futile. 
In 1997, the Conservatives proposed turning the “pay as you go” system into a “fully funded” arrangement. Workers would pay the same tax and National Insurance but a chunk would be invested in the manner of a private pension pot, hopefully growing over time. 
However, pension reform was not the issue of the day and Tony Blair’s Labour party vanquished John Major’s Conservatives in that year’s election. The proposal was left to gather dust. 
The coalition government took steps towards addressing the issue by introducing auto enrolled private pensions in 2012. 
Unless workers opt out, or do not meet the minimum income threshold, a slice of their earnings now go into a savings scheme that will give them a pension on retirement. The share of employees with a private pension has risen from below half in to almost 80pc as a result. 
Auto enrolled pensions should theoretically wean future retirees off a dependence on the state pension, giving governments leeway to reform the way it is funded or how much it pays out. 
Yet the wild success of the triple lock, which was also introduced by the coalition government around the same time, has effectively nullified this opportunity. Successive administrations have struggled to do anything other than increase the generosity of the state pension. 
Rishi Sunak plans to retain the “triple lock” on state pensions if he wins the next election, the Telegraph revealed this week. It is a sure vote winner – yet the issue of who and how these future promises will be sustainable paid for remains."
2024-03-01 06:19:24,"India 'easily' the fastest growing economy, IMF executive director says, as GDP growth blows past estimates","WATCH LIVE
Key Points
”If you look at the GDP numbers ... India’s poised for about 8% growth this year, that makes India easily the fastest growing economy in the world” — Krishnamurthy Subramanian, executive director at the IMF and former chief economic advisor of India.
India’s economy grew much faster than expected in the October to December quarter, data showed late on Thursday.
IMF Executive Director and former Chief Economic Advisor of India, Dr Krishnamurthy V. Subramanian addresses a press conference.
Hindustan Times | Hindustan Times | Getty Images
India is ’easily’ the fastest growing economy in the world, IMF executive director Krishnamurthy Subramanian said, as the country’s third-quarter GDP growth blew past analysts’ estimates.
At 8.4%, India’s economy expanded at its fastest pace in six quarters, data showed late on Thursday, strong private consumption and upbeat manufacturing and construction activity. Reuters estimates had pegged growth in the October to December period at 6.6%.
”If you look at the GDP numbers ... India’s poised for about 8% growth this year,” Subramanian, who is also a former chief economic advisor to the Indian government told CNBC’s ” Squawk Box Asia ” on Friday.
The Indian government also raised its GDP growth outlook for fiscal year 2023-24 to 7.6% from 7.3% forecast earlier.
Subramanian said that growth in India’s economy was driven by a shift in the government’s focus towards higher capital expenditure, which has increased significantly over the last few years.
watch now
The Indian Finance Ministry presented a fiscally prudent interim budget in early February, estimating that fiscal deficit for the financial year 2025 will narrow to 5.1%  from the revised 5.8% for 2024, while emphasizing the government’s plan to boost spending on infrastructure.
The interim budget estimated that capital expenditure will rise by 11.1% to 11.11 trillion Indian rupees ($133.9 billion) in fiscal year 2025, while tax revenue for the year is expected to increase by 11.4% to 38.31 trillion rupees.
Subramanian said he expected similar fiscal prudence from the full union budget, which will be released after India’s general elections.
”I do expect the focus on capital expenditure to continue and the fiscal math also is looking very responsible,” he added.
The GDP data has boosted Prime Minister Narendra Modi’s economic record ahead of a highly anticipated national election.
”For PM Modi and BJP (Bharatiya Janata Party) who will be going to the polls in April-May, it will yet provide another boost. For RBI (Reserve Bank of India), the strong growth momentum will only reinforce their bias to stay on hold at 6.5% for the foreseeable future,” Commerzbank analysts wrote in a note."
2024-02-28 22:32:35,West-financed NGOs seeking to destabilize situation in post-Soviet countries — diplomat,"”Financial support is rendered to various extremist, political, and religious organizations,” Russian Foreign Ministry Spokeswoman Maria Zakharova said MOSCOW, February 29. /TASS/. The West-financed non-governmental organizations are destabilizing the situation in post-Soviet countries seeking to create a ”belt of instability” around Russia, Russian Foreign Ministry Spokeswoman Maria Zakharova said. 
”Every year, the West allocates billions of dollars and euro to finance NGOs and media in Russia and other post-Soviet countries. In 2020, more than 2,000 NGOs and media outlets operated in the CIS countries on this money. Obviously, you know their agenda,” she said at the second congress of the International Movement of Russophiles. 
”The result of their so-called work is inevitable destabilization of the socio-political and economic situation in these countries, which creates the so-called belt of instability around Russia,” she said. 
Such efforts, in her words, are geared toward ”discrediting the regimes, governments and political forces in countries, which conduct an independent domestic and foreign policy, promoting their own political and moral values without taking into account the level of the development of political institutions, cultural and religious traditions and values in these countries.” ”Financial support is rendered to various extremist, political, and religious organizations,” she added."
2024-03-01 03:48:45,How Alberta’s 2024 budget could affect your finances,"451: Unavailable due to legal reasons
We recognize you are attempting to access this website from a country belonging to the European Economic Area (EEA) including the EU which             enforces the General Data Protection Regulation (GDPR) and therefore access cannot be granted at this time.                              For any issues, contact news@ottumwacourier.com or call (641) 684-4611 ."
2024-03-01 07:40:00,China's Coming 'Two Sessions' Put Plans to Jumpstart Economy in the Spotlight,China’s “Two Sessions” policy meetings kick off next week and the markets are watching to see what Beijing does to kick-start the world’s second-largest economy.
2024-03-01 07:47:50,How Alberta’s 2024 budget could affect your finances,"451: Unavailable due to legal reasons
We recognize you are attempting to access this website from a country belonging to the European Economic Area (EEA) including the EU which             enforces the General Data Protection Regulation (GDPR) and therefore access cannot be granted at this time."
