date,headline,description
2024-02-28 13:31:00,"U.S. economy’s growth in the fourth quarter downgraded to 3.2%, GDP shows","U.S. economy’s fourth-quarter growth rate downgraded to 3.2%, GDP shows. Still very strong.
Last Updated: Feb. 28, 2024 at 9:36 a.m. ET
First Published: Feb. 28, 2024 at 8:31 a.m. ET
By
Consumer spending is rising sharply
The U.S. economy hasn’t slowed down despite higher interest rates.
Getty Images
+0.52%
The growth rate of the U.S. economy in the fourth quarter was downgraded slightly to a 3.2% annual pace, but the economy is still expanding at a rapid clip and showing few signs of slowing down.
Originally the government said gross domestic product had expanded at a 3.3% rate in the final three months of 2023. The figure is adjusted for inflation.
The increase in fourth-quarter GDP followed an even stronger 4.9% gain in the third quarter. The economy does not appear to have lost a step early in the new year, either.
The latest forecasts suggest the U.S. is expanding at a rate of over 3% in the first quarter. The economy’s top sustainable speed in the long run is generally seen at around 1.8%.
What makes the recent strength even more remarkable is that it has taken place despite the sharply higher interest rates orchestrated by the Federal Reserve to tame in high inflation.
Big picture: The economy has weathered higher interest rates largely due to strong consumer spending that’s been underpinned by a muscular labor market.
Americans have been able to keep spending because they feel secure in their jobs. Higher spending in turn has negated the need for businesses to lay off lots of workers.
The prospect of the Fed cutting rates later in the year if inflation continues to wane is also acting as a strong tailwind.
Key details: Consumer spending, the main engine of the economy, was revised up to show a 3% increase in the fourth quarter instead of 2.8%.
Consumer spending accounts for about 70% of U.S. economic activity.
Overall business investment, the next largest peg of the economy, was weaker than originally reported.
Total spending rose just 09.%, compared with the initial 2.1% estimate, because of a decline in investment in new equipment.
Companies also rebuilt inventories at a slower pace than the initial GDP report showed. These are goods that have been produced but not sold yet.
Slower inventory growth largely accounted for the small reduction in headline GDP.
Inflation using the personal-consumption expenditure, or PCE, price index rose at a mild 1.8% annual rate in the fourth quarter, up a tick from the prior estimate.
The more closely followed core rate was also raised a notch to 2.1% — leaving it near the Fed’s 2% inflation goal.
The central bank aims to get the rate of inflation down to 2% for the full year.
Most other figures in the report were little changed. GDP is updated twice after its initial publication.
Looking ahead: “This all points to more domestic demand growth than previously thought and a hotter economy in general,” said James Knightley, chief international economist at ING. 
Market reaction: The Dow Jones Industrial Average DJIA and S&P 500 SPX fell in Wednesday trading.
Advertisement"
2024-03-01 12:00:41,Campaign finances 2024: Board of Supervisors,"By Jake Hutchison | jhutchison@chicoer.com | Chico Enterprise-Record
March 1, 2024 at 4:00 a.m.
CHICO — As the 2024 Butte County Board of Supervisors election draws near, candidates have submitted their campaign finance documents with lists of donors since July 2023.
Each candidate is required to fill out three documents, one for the entirety of their 2023 campaign followed by two in 2024 which are comprised of shorter timelines. One additional document will be filed for each through the end of the election cycle. So far, all finance documents are updated until Feb. 17, 2024.
Sitting supervisors Tod Kimmelshue and Doug Teeter raised more than their challengers, though District 4 has proven to be the highest-cost race.
Kimmelshue’s campaign once again raised the most, this year at about $75,000, overshadowed only by his 2020 race when he received nearly $250,000. District 4 Challenger Joanna Warrens also brought in a considerable amount at just over $32,000.
For District 5, Doug Teeter has collected more than $22,000 against opponent Julie Threet who has raised more than $8,000.
District 1 Supervisor Bill Connelly is running unopposed.
The following totals are comprised of individual donors, organizations and loans taken out by each candidate. Only donations of $100 or more are logged.
Tod Kimmelshue, District 4
As of Feb. 17, Kimmelshue’s campaign has netted $75,028, a considerable sum even when compared to his 2020 bout when his campaign raised almost a quarter of $1 million.
His highest donations came out to $2,500 each and came from farmers Lawrence Willadsen and Michael Koehnen as well as the Farm Political Action Committee out of Sacramento. Kimmelshue also received funding from three Chico City Council members with Dale Bennett giving $1,000, Tom van Overbeek giving $500 and Kasey Reynolds giving $250.
Notably, former U.S. Congressional candidate Audrey Denney provided $250 to Kimmelshue’s campaign.
The following organizations and individuals have donated to Kimmelshue’s campaign:
$1,000 and above: Lynette Leishman, Susan Stone, Peace Officers Research Association of California PAC, Coreen Davis, Michael Boeger, Dale Bennett, Gary Rudd, Stephen Schuster, Lawrence Willadsen, Farm PAC, California Water Service State and Local PAC, Michael Koehnen, Gage Chrysler, Matthew Thorpe
$500-$999: Debbie O’Sullivan, Tom van Overbeek, Western Manufactured Housing Communities Association PAC, Lance Tennis, James Jenkins, Thomas Dowd, Tim Hunzeker, Paul Violich, Robert Linscheid, Robert Foster, Roger Limberg, Tom Dauterman, Daniel Hutfless, Corinne Schwartz, Josh Sheppard
$400-$499: Joseph Hughes
$300-$399: J. Michael Murphy, Sally Donati
$200-$299: Kelby Sheppard, Carrie Monlux, John MacTavish, Kasey Reynolds, Larry Bradley, Patrick Orr, David Schlichting, Bridgit James, Heritage Insurance Agency Inc., Nathan Reis, Randy Linquist, Chico Locker and Sausage Co., Timothy Chambers, Paiva Farm Management Inc., Shaleen Hoff, Daniel Bozzo, Walter Stile, Lee Anne Burns, Audrey Denney, Randall Meline, Judy Struck, Stacie Corona
$100-$199: Ruth Younger, Ronald Ginochio, Jake Konyn, Jeff Cripe, David Barr, James Stevens, Michael Bertain, Cathleen Grzanich, Steven Abshier, Steven Koch, Steve Schaefer, Carroll Amator, William Carriere, Tim Voris, H. Connell, Richard Barnett, Frank Solinsky, Frank Cook, Alberta Simic, Catherine Thoma, Eric Lundberg, Stacey Gabski, Lionel Valley, Lyle Livingston
Joanna Warrens, District 4
Warrens has raised $32,080 since July 1, 2023.
Her largest donor came from her brother-in-law Grant Warrens who contributed $5,000 to her campaign.
Warrens also received financial support from local political agencies the Democratic Action Club of Chico and the Butte County Democratic Central Committee at $500 each.
Another notable donation came from Scott Rushing in the amount of $1,200.
The following organizations and individuals have donated to Warrens’ campaign:
$1,000 and above: Grant Warrens, Scott Rushing
$500-$999: Democratic Action Club of Chico, Butte County Democratic Central Committee, Teresa Giske
$300-$399: William Monroe
$200-$299: Teresa Hayes, Patrick Coghlan, Barbara Steinberg, Jane Howell, Linda Barker, Lynn Barris
$100-$199: Erik Havana, Rebecca Johnson, Robert Kidd, Freda Kirkham, Jerry Schacht, Jeanette Alosi, Lupita Arim-Law, George McRae, Barbara Litt
Doug Teeter, District 5
Sitting Supervisor Doug Teeter in his fourth run for the seat has raised a total of $22,299 as of Feb. 17, the vast majority of which came in the form of loans taken out.
Teeter’s two largest donors were the Peace Officers Research Association of California Political Action Committee, which also donated to Kimmelshue, and individual donor Sandra Benfield. Each donated $1,000.
The following organizations and individuals have donated to Teeter’s Campaign:
$1,000 and above: Peace Officers Research Association of California PAC, Sandra Benfield
$200-$299: Ronald Knauff
Julie Threet, District 5
In total, Threet has raised roughly $8,399 for her campaign in the race for District 5 supervisor.
Threet herself has funded the majority of her own campaign at more than $7,000 with her next biggest donor being Cynthia Pendry at $600.
The following organizations and individuals have donated to Threet’s Campaign:
$1,000 and above: Julie Threet
$500-$999: Angela Casler, Cynthia Pendry
$100-$199: Hetty Simoes
Bill Connelly, District 1
Since he’s running unopposed, Connelly has minimal donors with only one person listed as giving $500.
Connelly’s campaign finance documents show that he has taken on loans to the tune of $40,000 for 2024 to date and $37,500 in 2023. Connelly joined the board in 2005."
2024-03-01 12:06:03,BRAZIL’S ECONOMY FLAT IN FOURTH QUARTER," March 1 (Reuters) - Brazil’s economy was flat in the fourth quarter of 2023, government statistics agency IBGE said on Friday. 
The seasonally adjusted growth of Brazil’s gross domestic product (GDP) slightly missed the median forecast of a 0.1% growth in a Reuters poll of economists. 
Compared to a year earlier, the economy grew 2.1%, also below than the 2.2% rise economists had expected. (Reporting by Peter Frontini; editing by Gabriel Araujo)"
2024-03-01 12:23:51,Brazil’s economy grows 2.9% in 2023,"Brazil’s economy grows 2.9% in 2023
March 01, 2024 at 07:23 am EST
Share
SAO PAULO (Reuters) -     Brazil ended 2023 with an economic growth of 2.9%, official data showed on Friday, way above what economists expected for most of last year but maintaining in the fourth quarter a slowing trend that should cripple its expansion in 2024.
In a boost for President Luiz Inacio Lula da Silva in his first year in office, gross domestic product (GDP) in Latin America’s No.1 economy defied gloomy forecasts that in early 2023 pointed to a mere 0.8% calendar-year growth amid stiflingly high interest rates.
In the fourth quarter of 2023, according to statistics agency IBGE, Brazil’s GDP was flat, in line with the previous quarter but slightly missing the 0.1% growth expected by economists polled by Reuters.
On an annual basis, growth in the October-December quarter came in at 2.1%, also below than the 2.2% rise economists had expected.
(Reporting by Peter Frontini and Gabriel Araujo; Editing by Chizu Nomiyama)
Share"
2024-03-01 12:23:51,BRAZIL’S ECONOMY GROWS 2.9% IN 2023," SAO PAULO (Reuters) - Brazil ended 2023 with an economic growth of 2.9%, official data showed on Friday, way above what economists expected for most of last year but maintaining in the fourth quarter a slowing trend that should cripple its expansion in 2024. 
In a boost for President Luiz Inacio Lula da Silva in his first year in office, gross domestic product (GDP) in Latin America’s No.1 economy defied gloomy forecasts that in early 2023 pointed to a mere 0.8% calendar-year growth amid stiflingly high interest rates. 
In the fourth quarter of 2023, according to statistics agency IBGE, Brazil’s GDP was flat, in line with the previous quarter but slightly missing the 0.1% growth expected by economists polled by Reuters. 
On an annual basis, growth in the October-December quarter came in at 2.1%, also below than the 2.2% rise economists had expected. 
(Reporting by Peter Frontini and Gabriel Araujo; Editing by Chizu Nomiyama)"
2024-03-01 12:19:10,UPDATE 1-BRAZIL’S ECONOMY GROWS 2.9% IN 2023," (Recasts throughout) 
SAO PAULO, March 1 (Reuters) - 
Brazil ended 2023 with an economic growth of 2.9%, official data showed on Friday, way above what economists expected for most of last year but maintaining in the fourth quarter a slowing trend that should cripple its expansion in 2024. 
In a boost for President Luiz Inacio Lula da Silva in his first year in office, gross domestic product (GDP) in Latin America’s No.1 economy defied gloomy forecasts that in early 2023 pointed to a mere 0.8% calendar-year growth amid stiflingly high interest rates. 
In the fourth quarter of 2023, according to statistics agency IBGE, Brazil’s GDP was flat, in line with the previous quarter but slightly missing the 0.1% growth expected by economists polled by Reuters. 
On an annual basis, growth in the October-December quarter came in at 2.1%, also below than the 2.2% rise economists had expected. (Reporting by Peter Frontini and Gabriel Araujo; Editing by Chizu Nomiyama)"
2024-02-28 13:00:00,"NLP in Finance Market worth $18.8 billion by 2028, growing at a CAGR of 27.6%: Report by MarketsandMarkets™","Download PDF Brochure @ https://www.marketsandmarkets.com/pdfdownloadNew.asp?id=21737879
The rise in content creation and creative application, evolution in AI and deep learning, innovation of cloud storage enabling easy access to data, and acceleration in the deployment of Large Language Models (LLMs).
IBM defines natural language processing (NLP) as the branch of computer science—specifically, artificial intelligence or AI—concerned with giving computers the ability to understand the text and spoken words the same way human beings can. In finance, NLP can perform tasks such as sentiment analysis, topic modeling, entity recognition, and summarization. These tasks can help analysts and traders gain insights in market trends, investor sentiments, and the company’s or sector’s performance. NLP can automate tasks such as news monitoring, regulatory compliance, and customer service.
NLP in Finance Market Dynamics:
Drivers:
Increasing demand for automated and efficient financial services worldwide
Rising need for accurate and real-time analysis of complex financial data
Emergence of AI and ML models
Opportunities:
Development of customized NLP solutions for specific financial services and use cases
Integration of NLP with blockchain and big data to enhance accuracy and efficiency of financial operations
Growing adoption of NLP-powered chatbots and virtual assistants
Restraints:
Lack of standardization in NLP-based financial applications and services
Difficulty in managing large volumes of unstructured data
Complexity in developing and training sophisticated NLP models
List of key players in NLP in Finance Market:
Microsoft (US),
Make an Enquiry @ https://www.marketsandmarkets.com/Enquiry_Before_BuyingNew.asp?id=21737879
Based on offering, the NLP in finance market is segmented into software and services. The software segment is projected to garner a high revenue during the forecast period, attributed to the growing importance of NLP in finance software among creative professionals due to the increasing demand for NLP tools in the finance industry. The adoption of NLP solutions is expected to grow due to the increasing demand for accurate and personalized insights in the finance industry. The services segment is projected to witness a high growth rate during the forecast period.
Based on technology, the segment has been bifurcated into machine learning, deep learning, natural language generation, text classification, topic modeling, emotion detection, and others (named entity recognition and event extraction). The machine learning segment is expected to garner a higher revenue during the forecast period and is playing a crucial role in enhancing NLP in finance. Machine learning algorithms can be trained on large volumes of textual data to recognize patterns and identify sentiment in financial news, social media, and other sources. This enables analysts to quickly gain insights in market trends and make more informed investment decisions.
The NLP in finance market has been segmented into five regions: North America, Europe, the Middle East & Africa, Asia Pacific, and Latin America. North America is estimated to account for the largest market share during the forecast period, while Asia Pacific is estimated to grow at the highest rate. North America has a lot of technological research centers, human capital, and strong infrastructure. Moreover, the rise in technical support and the developed R&D sector in the region fuels the market’s growth. NLP has been widely adopted in the finance industry in North America for various applications, including sentiment analysis, fraud detection, risk management, and customer service. In Asia Pacific, the need for greater customer service and engagement and the increasing use of virtual assistants and chatbots in the banking and financial service industry is driving the need for NLP solutions.
Browse Adjacent Markets:  Artificial Intelligence (AI) Market Research Reports & Consulting
Browse Other Reports:
NLP in Finance Market NLP for Finance Financial NLP NLP in Finance Market Size NLP in Finance Market Share NLP in Finance
Contact Data
About MarketsandMarkets™  MarketsandMarkets™ has been recognized as one of America’s best management consulting firms by Forbes, as per their recent report.  MarketsandMarkets™ is a blue ocean alternative in growth consulting and program management, leveraging a man-machine offering to drive supernormal growth for progressive organizations in the B2B space. We have the widest lens on emerging technologies, making us proficient in co-creating supernormal growth for clients.  Earlier this year, we made a formal transformation into one of America’s best management consulting firms as per a survey conducted by Forbes.  The B2B economy is witnessing the emergence of $25 trillion of new revenue streams that are substituting existing revenue streams in this decade alone. We work with clients on growth programs, helping them monetize this $25 trillion opportunity through our service lines - TAM Expansion, Go-to-Market (GTM) Strategy to Execution, Market Share Gain, Account Enablement, and Thought Leadership Marketing.  Built on the ’GIVE Growth’ principle, we work with several Forbes Global 2000 B2B companies - helping them stay relevant in a disruptive ecosystem. Our insights and strategies are molded by our industry experts, cutting-edge AI-powered Market Intelligence Cloud, and years of research. The KnowledgeStore™ (our Market Intelligence Cloud) integrates our research, facilitates an analysis of interconnections through a set of applications, helping clients look at the entire ecosystem and understand the revenue shifts happening in their industry.  To find out more, visit www.MarketsandMarkets™.com or follow us on Twitter, LinkedIn and Facebook.  Contact: Mr. Aashish Mehra MarketsandMarkets™ INC. 630 Dundee Road Suite 430 Northbrook, IL 60062 USA: +1-888-600-6441 Email: sales@marketsandmarkets.com"
2024-03-01 12:33:07,PLUG POWER INC (PLUG) REPORTS YEAR OF STRATEGIC GROWTH AMIDST ADVANCING GREEN HYDROGEN ECONOMY," On March 1, 2024, Plug Power Inc (NASDAQ:PLUG) released its 8-K filing, announcing its financial results and operational milestones for the quarter and fiscal year ended December 31, 2023. The company, a global leader in comprehensive hydrogen solutions for the green hydrogen economy, has reported a year marked by strategic growth and advancements, underlining its commitment to a sustainable future. 
Plug Power Inc (NASDAQ:PLUG) is at the forefront of building an end-to-end green hydrogen ecosystemfrom production to energy generation. The company’s efforts are geared towards creating a green hydrogen highway across North America and Europe, delivering solutions directly to customers and through joint venture partners in various markets. 
The company has successfully commissioned the Georgia hydrogen plant, boasting the largest PEM electrolyzer system in the United States. This, along with the deployment of a large-scale megawatt-level stationary product, represents significant progress in Plug Power Inc (NASDAQ:PLUG)’s hydrogen production capabilities. In the material handling space, the company has expanded its installed base with existing key customers such as Walmart, Home Depot, and Amazon, and has introduced a new platform for mid-market material handling sites. 
Plug Power Inc (NASDAQ:PLUG) has also made headway in its Energy Solutions business, closing a 100MW electrolyzer project for GALP and nearly 1GW in BEDP for various projects. The launch of new products, including hydrogen storage tanks and a mobile liquid hydrogen refueler, demonstrates the company’s innovation in the energy sector. 
The company’s strategic achievements are not just limited to operational milestones. The CEO’s vision encompasses a broader goal of decarbonizing the economy and achieving energy independence through sustainable solutions. Plug Power Inc (NASDAQ:PLUG) has deployed over 69,000 fuel cell systems and more than 250 fueling stations, making it a significant player in the hydrogen fuel cell technology market. 
With plans to operate a green hydrogen highway and develop multiple green hydrogen production plants targeting commercial operation by year-end 2028, Plug Power Inc (NASDAQ:PLUG) is positioning itself as a leader in the transition to renewable energy sources. 
The importance of these achievements cannot be overstated. As the world moves towards cleaner energy solutions, Plug Power Inc (NASDAQ:PLUG)’s advancements in the green hydrogen economy are not only pivotal for the company’s growth but also for the industry’s shift towards sustainable practices. The company’s financial health and strategic investments are critical in supporting its ambitious projects and maintaining its competitive edge in the Industrial Products sector. 
Plug Power Inc (NASDAQ:PLUG) has scheduled a conference call to further discuss the quarter’s results and future plans. The call is expected to provide additional insights into the company’s strategy and outlook for the coming years. 
For more detailed information on Plug Power Inc (NASDAQ:PLUG)’s financial results, operational achievements, and strategic vision, interested parties can visit the company’s website or access the webcast of the conference call. 
As Plug Power Inc (NASDAQ:PLUG) continues to innovate and expand its reach in the green hydrogen market, its financial results and operational milestones serve as a testament to the company’s potential and the growing importance of sustainable energy solutions. 
Explore the complete 8-K earnings release (here) from Plug Power Inc for further details. 
This article first appeared on GuruFocus."
2024-02-28 14:08:49,TradeXBank seeks commodity finance growth with chief executive hire,"Zurich-based commodity trade finance lender TradeXBank, formed in 2022 after the
sale of sanctions-hit Sberbank’s Swiss subsidiary, has announced the hire of
Camille Sednaoui as chief executive.

Sednaoui boasts more than three decades in transaction commodity finance, and
joins from Crédit Agricole, where he headed the bank’s international trade and
transaction banking department in Switzerland.

TradeXBank says he is tasked with executing its strategic growth plans and
establishing its presence in the commodity trade finance market.

“There is high demand in the market for an agile Swiss bank like TradeXBank,
that is serving its clients with bespoke solutions,” Sednaoui says. “We are
committed to further grow the business without compromising risk and
compliance.”

Bank chairman Christian Luescher, a veteran lawyer and former Swiss
parliamentarian, adds the appointment will help “re-establish our bank as a
strong player in the market”.

TradeXBank started life in September 2022 after the acquisition of Sberbank
Switzerland by m3 Groupe, which has operations in real estate, healthcare and
hospitality.

Swiss authorities temporarily halted certain sanctions requirements to
facilitate the sale, with TradeXBank taking over the banking licence previously
held by the Russian-owned lender.

Although clients withdrew around CHF1.5bn in assets prior to the acquisition, it
retained between CH600mn (US$681mn) and CHF700mn on hand and benefited from a
CHF500mn equity injection from m3 Groupe, making it one of the 20 largest Swiss
banks, executives said at the time.

Its focus is on financing trade in energy, metals, agricultural goods and
fertilisers.

TradeXBank’s progress contrasts with that of Amsterdam Trade Bank, a one-time
trade finance specialist that was considered a solvent and healthy business
until sanctions were imposed on its Russian parent company, Alfa Bank.

With counterparties no longer able to do business with the bank, it was placed
into the hands of bankruptcy trustees by a Dutch court in April 2022.

The post TradeXBank seeks commodity finance growth with chief executive hire 
appeared first on Global Trade Review (GTR)."
